,Unnamed: 0,FeatureName,FeatureID,teamID,ReviewID,asin,title,Sentence,CS_SS,p/n
1274,1274,compression,20,12,6104830,B00889ST2G,Sony DSC-RX100/B 20.2 MP Exmor CMOS Sensor Digital Camera with 3.6x Zoom,The JPEGs are quite good for now.One of the best features is the pop up flash which can be tilted backward (you have to manual hold it in place) for bounce flash.,CS,P
1275,1275,compression,20,12,6104835,B00889ST2G,Sony DSC-RX100/B 20.2 MP Exmor CMOS Sensor Digital Camera with 3.6x Zoom,Most are restricted to JPEG.,CS,N
1276,1276,compression,20,12,6104835,B00889ST2G,Sony DSC-RX100/B 20.2 MP Exmor CMOS Sensor Digital Camera with 3.6x Zoom,"I would like to have available the auto-HDR or long exposure noise reduction as well for RAW, but OK. And the quality of JPEGs is amazing.",CS,P
1277,1277,compression,20,12,6104835,B00889ST2G,Sony DSC-RX100/B 20.2 MP Exmor CMOS Sensor Digital Camera with 3.6x Zoom,"I compared a RAW and a JPEG side by side in Lightroom: there is some more sharpness with RAW, yes, but JPEGS are still impressive, and those many creative modes are fun to play with.",CS,P
1278,1278,compression,20,12,6104835,B00889ST2G,Sony DSC-RX100/B 20.2 MP Exmor CMOS Sensor Digital Camera with 3.6x Zoom,"Compare this to 5MB JPEGs, and you know why I always toggle between "" I want highest quality whatsoever"" and ""do not fill up  your time mashine backup unwarily"".One weekend I did not use the camera, and the battery was drained afterwards.",CS,N
1279,1279,compression,20,12,6104844,B00889ST2G,Sony DSC-RX100/B 20.2 MP Exmor CMOS Sensor Digital Camera with 3.6x Zoom,"Since Adobe released Lightroom 4.2 RC, Raw file can extract more details for high ISO setting, but jpeg out of camera is better than what I expected as well as the vignetting, distortion, purple fringe compensation.Cons:1.front dial is smooth, the smooth dial is excellent for manual focus, but I prefer tick dial to adjust values.2.modal dial is a little tighten to turn.4.no dedicate on/off button for flash.",CS,P
1280,1280,compression,20,12,6118294,B00894YWD0,Canon EOS Rebel T4i DSLR with 18-55mm EF-S IS II Lens (OLD MODEL),"In fact, both cameras have exactly the same buffer (internal memory) capacity for RAW images (6), while the T3i has a superior buffer capacity for .jpegs (34 compared to 30 for the new T4i).",CS,P
1281,1281,compression,20,12,6118294,B00894YWD0,Canon EOS Rebel T4i DSLR with 18-55mm EF-S IS II Lens (OLD MODEL),"The bottom line is that for all practical purposes, the cameras will capture images at virtually the same speed, although the T3i may be slightly better with .jpegs.",CS,P
1282,1282,compression,20,12,6118352,B00894YWD0,Canon EOS Rebel T4i DSLR with 18-55mm EF-S IS II Lens (OLD MODEL),"Most of my pictures were taken in raw format, then converted to jpeg format using Canon provided software.",CS,nothing
1283,1283,compression,20,12,6289173,B008MB6YX6,Panasonic Lumix DMC-FZ60 16.1 MP Digital Camera with 24x Optical Zoom - Black,"I have not missed RAW for my portrait pictures, the JPEG images from the FZ60 are excellent.",SS,nothing
1284,1284,compression,20,12,6289286,B008MB6ZX0,Panasonic Lumix DMC-FZ200 12.1 MP Digital Camera with CMOS Sensor and 24x Optical Zoom - Black,Note that I am comparing both JPEG and RAW.,SS,nothing
1285,1285,compression,20,12,6289313,B008MB6ZX0,Panasonic Lumix DMC-FZ200 12.1 MP Digital Camera with CMOS Sensor and 24x Optical Zoom - Black,The Canon shot only RAW and the FZ shot BOTH taw and jpeg.,CS,nothing
1286,1286,compression,20,12,6289313,B008MB6ZX0,Panasonic Lumix DMC-FZ200 12.1 MP Digital Camera with CMOS Sensor and 24x Optical Zoom - Black,"I haven't figured out how to use the Panasonic RAW software yet, so we ended up comparing Canon raw with FZ high quality jpegs.When viewed ""right out of the camera"" on my 27"" color calibrated iMac, the images look virtually identical.",SS,P
1287,1287,compression,20,12,6289342,B008MB6ZX0,Panasonic Lumix DMC-FZ200 12.1 MP Digital Camera with CMOS Sensor and 24x Optical Zoom - Black,I love being able to shoot both JPEG and RAW at the same time.,SS,P
1288,1288,compression,20,12,6289342,B008MB6ZX0,Panasonic Lumix DMC-FZ200 12.1 MP Digital Camera with CMOS Sensor and 24x Optical Zoom - Black,"I've always wanted to learn RAW, and now I can do so while having the familiar JPEG too.",SS,nothing
1289,1289,compression,20,12,6289363,B008MB6ZX0,Panasonic Lumix DMC-FZ200 12.1 MP Digital Camera with CMOS Sensor and 24x Optical Zoom - Black,"...how this FZ200 performs under the most punishing possible conditions: Very low light, all shakily hand-held, JPEG, most of these extended or digital zoom, no flash EVER, ""threading-the-needle"" manual focus through both windows and screens, moving car, TV screen shots, amateur photographer at the wheel, and decide for yourself if this fits your needs:I guess you need to hit COMMENT to request the link, after which you simply COPY AND PASTE to the address bar, single click on ALBUMS, single click on one of the first two albums, click on Photo Details, and right cursor your way through.",CS,P
1290,1290,compression,20,12,6289377,B008MB6ZX0,Panasonic Lumix DMC-FZ200 12.1 MP Digital Camera with CMOS Sensor and 24x Optical Zoom - Black,I haven't been able to process the RAW files yet -- a Lightroom update is on the way soon -- but the JPEGs look pretty nice OOC.,SS,P
1291,1291,compression,20,12,6289458,B008MB6ZX0,Panasonic Lumix DMC-FZ200 12.1 MP Digital Camera with CMOS Sensor and 24x Optical Zoom - Black,My first JPEGs were bright and sharp enough for my tastes and the ability to capture both JPEG and RAW at the same time is a really nice feature.,CS,P
1292,1292,compression,20,12,6289458,B008MB6ZX0,Panasonic Lumix DMC-FZ200 12.1 MP Digital Camera with CMOS Sensor and 24x Optical Zoom - Black,The fine quality JPEGs will suffice for those who want high quality photos right out of the box.,SS,P
1293,1293,compression,20,12,6289506,B008MB6ZX0,Panasonic Lumix DMC-FZ200 12.1 MP Digital Camera with CMOS Sensor and 24x Optical Zoom - Black,Forget about using any kind of extended zoom like I-Zoom because the compression noise was terrible.,CS,N
1294,1294,compression,20,12,6289506,B008MB6ZX0,Panasonic Lumix DMC-FZ200 12.1 MP Digital Camera with CMOS Sensor and 24x Optical Zoom - Black,The worms and compression trash was gone.,SS,N
1295,1295,compression,20,12,6289510,B008MB6ZX0,Panasonic Lumix DMC-FZ200 12.1 MP Digital Camera with CMOS Sensor and 24x Optical Zoom - Black,"There are a lot of things I like about the camera (size, controls, features, lens speed) but after a couple of hundred shots comparing the FZ200 with five other cameras, there were four things that caused it to go back.1) A consistent cool bluish tint on outdoor pictures.2) A frequent reddish tint on indoor pictures taken with flash.3) Blowout/loss of detail of light colored items in high-contrast situations.4) Image quality when cropping and enlarging elements of a photo.The other cameras I was comparing with the FZ200 were:* An old 8 megapixel Canon S5IS* A newish Canon EOS Rebel T3i* New Nikon P510* New Canon SX40 HS* New Fujifilm HS30 EXRIn my testing, all five of the other cameras performed much better in regard to color accuracy (items 1 and 2 above), and were also better in regard to image quality (items 3 & 4 above) when processing JPEGs.",CS,P
1296,1296,compression,20,12,6289510,B008MB6ZX0,Panasonic Lumix DMC-FZ200 12.1 MP Digital Camera with CMOS Sensor and 24x Optical Zoom - Black,"Perhaps I got a bad unit--I might try another one just in case that's what happened, but I think I'll wait until it's been on the market for a while--see if they make any adjustments regarding color accuracy and JPEG quality.Added October 4, 2012I stopped at National Camera Exchange and with their help, compared the image quality of the FZ200 with another less expensive camera (the Canon SX500 IS--just $299 at Amazon).",CS,N
1297,1297,compression,20,12,6289510,B008MB6ZX0,Panasonic Lumix DMC-FZ200 12.1 MP Digital Camera with CMOS Sensor and 24x Optical Zoom - Black,"Much to their surprise, they too found that when enlarging the JPEG image, the little Canon had better image quality than the FZ200.",CS,P
1298,1298,compression,20,12,6289510,B008MB6ZX0,Panasonic Lumix DMC-FZ200 12.1 MP Digital Camera with CMOS Sensor and 24x Optical Zoom - Black,"They then compared the FZ200 with the Canon SX40 HS and the Nikon P5100, and found JPEG image quality better on those cameras as well.Hopefully Panasonic will come out with a firmware update that will fix the color and image quality/resolution issues.",CS,nothing
1299,1299,compression,20,12,6289522,B008MB6ZX0,Panasonic Lumix DMC-FZ200 12.1 MP Digital Camera with CMOS Sensor and 24x Optical Zoom - Black,"However, the in-camera JPEG engine is worthless.",SS,N
1300,1300,compression,20,12,6289522,B008MB6ZX0,Panasonic Lumix DMC-FZ200 12.1 MP Digital Camera with CMOS Sensor and 24x Optical Zoom - Black,It is VERY noisy with JPEG.,SS,N
1301,1301,compression,20,12,6289522,B008MB6ZX0,Panasonic Lumix DMC-FZ200 12.1 MP Digital Camera with CMOS Sensor and 24x Optical Zoom - Black,"With this limitation, any forced JPEG modes (i.e.",SS,N
1302,1302,compression,20,12,6289522,B008MB6ZX0,Panasonic Lumix DMC-FZ200 12.1 MP Digital Camera with CMOS Sensor and 24x Optical Zoom - Black,The in-camera JPEG is hopelessly aggressive and full of artifice.,SS,N
1303,1303,compression,20,12,6289522,B008MB6ZX0,Panasonic Lumix DMC-FZ200 12.1 MP Digital Camera with CMOS Sensor and 24x Optical Zoom - Black,"The AI is poor (It tends to wash out), and coupled with forced JPEG mode with AI or AI+, this mode is useless to me.",SS,N
1304,1304,compression,20,12,6289648,B008MB70TI,Panasonic LUMIX DMC-LX7W 10.1 MP Digital Camera with 7.5x Intelligent zoom and 3.0-inch LCD - White,"I brought this issueup with Panasonic and they said it is ""a natural phenomenon with digital cameras due to the bending of light read into the image sensor and the compression of imagefile.""",SS,nothing
1305,1305,compression,20,12,6289655,B008MB70TI,Panasonic LUMIX DMC-LX7W 10.1 MP Digital Camera with 7.5x Intelligent zoom and 3.0-inch LCD - White,"I get more usable shots from my Panasonic LX-series cameras than I do with my Canon S-series cameras because of this feature.- The macro is very good on LX cameras, with extremely close focusing distances when zoomed out.- Marketing gimmicks: 3D (kinda fun, actually, if you can convert the files), time-lapse, HDR, panorama, high-speed video, 1080p video with stereo audio, aspect bracketing, multi-exposure night mode, some good burst modes for JPEG shooters, and some other nice features I'm not likely to ever use.What I don't like:- It's noteceably bigger and heavier than the LX5.- Relatively slow zoom in/out (same as LX5).",CS,P
1306,1306,compression,20,12,6289655,B008MB70TI,Panasonic LUMIX DMC-LX7W 10.1 MP Digital Camera with 7.5x Intelligent zoom and 3.0-inch LCD - White,"I really love what Fujifilm is doing with their stylish, retro designs and innovative controls built around very capable compacts that supposedly product stunning JPEGs but lousy RAW images (due to their maverick sensor designs).",SS,P
1307,1307,compression,20,12,6289661,B008MB70TI,Panasonic LUMIX DMC-LX7W 10.1 MP Digital Camera with 7.5x Intelligent zoom and 3.0-inch LCD - White,"I will be placing images on my website (google my name) as time goes on, and my images there are average to worst case JPEG's processed in Paint Shop Pro v6 (ca.1999) rather than highly tuned RAW images processed in Lightroom or Photoshop.",SS,N
1308,1308,compression,20,12,6289661,B008MB70TI,Panasonic LUMIX DMC-LX7W 10.1 MP Digital Camera with 7.5x Intelligent zoom and 3.0-inch LCD - White,"There are other websites that have or will have the optimized images, so mine will provide a good comparison as to what can be done with JPEG's and minimal (rotate, crop, lighten/darken) post-processing (PP).",SS,P
1309,1309,compression,20,12,6289707,B008MB70TI,Panasonic LUMIX DMC-LX7W 10.1 MP Digital Camera with 7.5x Intelligent zoom and 3.0-inch LCD - White,"It shoots JPEG and RAW pictures and will shoot 1080p movies, awesome.",SS,P
1310,1310,compression,20,12,6289717,B008MB70TI,Panasonic LUMIX DMC-LX7W 10.1 MP Digital Camera with 7.5x Intelligent zoom and 3.0-inch LCD - White,"Let me start with what could be better:Color/White Balance especially under artificial lights.Zoom speed and response.Somewhat Flat Colors from the JPEG Engine.Noise at ISO400 and above.Having said that, this little gem is worth every cent that you spend on it.",CS,P
1311,1311,compression,20,12,6289795,B008MB70TI,Panasonic LUMIX DMC-LX7W 10.1 MP Digital Camera with 7.5x Intelligent zoom and 3.0-inch LCD - White,But at least the JPEG creation on this camera is superior to the LX5 (the previous model).,CS,P
1312,1312,compression,20,12,6289795,B008MB70TI,Panasonic LUMIX DMC-LX7W 10.1 MP Digital Camera with 7.5x Intelligent zoom and 3.0-inch LCD - White,The LX5 JPEGs were really messy.,SS,N
1313,1313,compression,20,12,6289840,B008MB70TI,Panasonic LUMIX DMC-LX7W 10.1 MP Digital Camera with 7.5x Intelligent zoom and 3.0-inch LCD - White,You don't hold up your companions setting up a tripod shot.2) Wide angle - no need for a panorama when the wide angle lens can get it all3) Compact - light and small enough to hand around your neck all day without being uncomfortable4) Raw - Most of the time I take jpeg simply to document the hike.,CS,P
1314,1314,compression,20,12,6289895,B008MB70TI,Panasonic LUMIX DMC-LX7W 10.1 MP Digital Camera with 7.5x Intelligent zoom and 3.0-inch LCD - White,"It has a better LCD, a bigger sensor, first-rate video capabilities, a hot shoe, JPEG, JPEG+RAW, and RAW capability, and includes the fastest lens in this category of camera today: F1.4-2.3.",CS,P
1315,1315,compression,20,12,6289950,B008MB70TI,Panasonic LUMIX DMC-LX7W 10.1 MP Digital Camera with 7.5x Intelligent zoom and 3.0-inch LCD - White,The JPEG files are an improvement over the LX5 and the RAW files are simply stunning and compare quite nicely (at low ISOs) to APS-C cameras.,SS,P
1316,1316,compression,20,12,6289955,B008MB70TI,Panasonic LUMIX DMC-LX7W 10.1 MP Digital Camera with 7.5x Intelligent zoom and 3.0-inch LCD - White,"The ""intelligent HDR"" mode, for instance, saves only in JPEG format.",CS,P
1317,1317,compression,20,12,6289955,B008MB70TI,Panasonic LUMIX DMC-LX7W 10.1 MP Digital Camera with 7.5x Intelligent zoom and 3.0-inch LCD - White,(Now why go to the trouble of using HDR if you only get a jpeg file to work with?,CS,nothing
1318,1318,compression,20,12,6290042,B008MB71IS,Panasonic DMC-G5KK 16 MP Compact System Camera with 14-42mm Zoom Lens and 3-Inch LCD (Black),I learned quickly how to use the custom white balance setting and my out of camera jpeg files have consistently accurate color rendition.,SS,P
1319,1319,compression,20,12,6294488,B008MJ01QE,"Fujifilm F800EXR 16MP Digital Camera with 20x Optical Image Stabilized Zoom and 3.0-Inch TFT LCD, Black",I've been shooting RAW+jpeg so I'm covered.,SS,nothing
1320,1320,compression,20,12,6294505,B008MJ01QE,"Fujifilm F800EXR 16MP Digital Camera with 20x Optical Image Stabilized Zoom and 3.0-Inch TFT LCD, Black","The camera was even to able to know the difference for the various pictures I needed to take.The camera is capable of taking RAW images, or even RAW and JPEG together so you have a RAW image for later editing and a JPEG image for easy sharing.The  quality is superb, and the optical and intelligent digital zoom is also amazing.The  camera can take Full HD video, and also 'High-Speed' video (up to 320 frames per second) that when played at normal speed slows the action right down - this can be useful both in sport videos and nature videos.",CS,P
1321,1321,compression,20,12,6303861,B008NENG1A,Canon EOS M 18.0 MP Compact Systems Camera with 3.0-Inch LCD and EF-M 22mm STM Lens,It has a 3.5 jack for external microphones.There are several auto scene modes basically available for jpeg only shooting like HDR backlight control that will take a 3 shot bracketed series and blend them in camera into one image.,CS,P
1322,1322,compression,20,12,6303861,B008NENG1A,Canon EOS M 18.0 MP Compact Systems Camera with 3.0-Inch LCD and EF-M 22mm STM Lens,There is also a multi-shot noise reduction mode available for jpeg shooting along with handheld night scene mode (multi-shot).,SS,nothing
1323,1323,compression,20,12,6428506,B00908BMVE,Canon PowerShot SX500 IS 16.0 MP Digital Camera with 30x Wide-Angle Optical Image Stabilized Zoom and 3.0-Inch LCD (Black),"The focusing screen was never &#34;in focus;&#34; the quality of the images was very poor, even using the fine quality jpeg option.",SS,nothing
1324,1324,compression,20,12,6435334,B0090SLE30,Nikon COOLPIX P7700 12.2 MP Digital Camera with 7.1x Optical Zoom NIKKOR ED Glass Lens and 3-inch Vari-Angle LCD,This is a very nice camera for JPEG imaging but it has a LOT of grain with RAW files at ISO 400 and above.,SS,P
1325,1325,compression,20,12,6435334,B0090SLE30,Nikon COOLPIX P7700 12.2 MP Digital Camera with 7.1x Optical Zoom NIKKOR ED Glass Lens and 3-inch Vari-Angle LCD,"The Nikon P7700 is, however, much better at rendering JPEG and RAW files than my previous camera, the Canon S95.I appreciate all the easily-changed settings options on the outside of the camera, the quality of the JPEG files, the accurate white balance and the camera's very helpful capabilities in low light.",CS,P
1326,1326,compression,20,12,6435343,B0090SLE30,Nikon COOLPIX P7700 12.2 MP Digital Camera with 7.1x Optical Zoom NIKKOR ED Glass Lens and 3-inch Vari-Angle LCD,"The G15 is just as good, but it's FASTER to lock and the overall AF experience is snappier.Speed:Shooting JPEG the P7700 is about average.",SS,P
1327,1327,compression,20,12,6454380,B0092MD5UY,Fujifilm X-E1 16.3 MP Compact System Digital Camera with 2.8-Inch LCD - Body Only (Silver),"No matter how good a camera feels it is worthless if the image quality isn't good, the IQ from the X-E1 is excellent, I always shot Raw, but am reliving the film days playing with the JPEG film simulation modes.",SS,P
1328,1328,compression,20,12,6454384,B0092MD5UY,Fujifilm X-E1 16.3 MP Compact System Digital Camera with 2.8-Inch LCD - Body Only (Silver),"The camera shoots unbelievably good jpegs that require very little adjustment, however, so this is not a major problem.",SS,N
1329,1329,compression,20,12,6454389,B0092MD5UY,Fujifilm X-E1 16.3 MP Compact System Digital Camera with 2.8-Inch LCD - Body Only (Silver),The Fuji jpegs are great as I only shot raw prior to getting the Xpro1.,CS,P
1330,1330,compression,20,12,6454397,B0092MD5UY,Fujifilm X-E1 16.3 MP Compact System Digital Camera with 2.8-Inch LCD - Body Only (Silver),"Mainly the manual dials, built quality, jpeg colors, and size.update: The first issue I mentioned can be fixed by updating the lens and body to a new firmware available through Fuji website.update: Went shooting today and got a chance to play with my friend's all black X-e1.",CS,nothing
1331,1331,compression,20,12,6454400,B0092MD5UY,Fujifilm X-E1 16.3 MP Compact System Digital Camera with 2.8-Inch LCD - Body Only (Silver),"In the meantime if you do not mind shooting Jpeg the XE-1 has a killer jpeg engine in it and they look fantastic!VideoThe OMD is pretty decent for video, it is not up to par with many other cameras but the 5 way IBIS makes it seem like the camera is floating on a steady cam unit.",CS,P
1332,1332,compression,20,12,6454414,B0092MD5UY,Fujifilm X-E1 16.3 MP Compact System Digital Camera with 2.8-Inch LCD - Body Only (Silver),"Had to use different lenses of course (18-55mm zoom on Sony, 24-85mm zoom on Nikon, 18-55mm zoom on Fuji), and all shots were JPEGs, so this comparison does not make it possible to distinguish the relative contributions of sensors, lenses, jpeg processors.",CS,nothing
1333,1333,compression,20,12,6454414,B0092MD5UY,Fujifilm X-E1 16.3 MP Compact System Digital Camera with 2.8-Inch LCD - Body Only (Silver),"All pix were blown up to the screen equivalent of about 24"" wide.A word about JPEGs vs.",SS,nothing
1334,1334,compression,20,12,6454414,B0092MD5UY,Fujifilm X-E1 16.3 MP Compact System Digital Camera with 2.8-Inch LCD - Body Only (Silver),"RAW: It is important to understand that modern lenses including these three are no longer just hunks of glass; they are designed to be used with the in-camera JPEG processing firmware, which undoes the inherent distortions on the wide angle side.",CS,P
1335,1335,compression,20,12,6454414,B0092MD5UY,Fujifilm X-E1 16.3 MP Compact System Digital Camera with 2.8-Inch LCD - Body Only (Silver),"JPEG's are the way these lenses are designed to be used, so that's how they should be evaluated, as part of the whole camera.Results at ISO 3200:- Nikon D600 (full frame) gave the nicest image, as we should certainly expect for the sensor size, camera size and weight, and cost.",CS,P
1336,1336,compression,20,12,6454414,B0092MD5UY,Fujifilm X-E1 16.3 MP Compact System Digital Camera with 2.8-Inch LCD - Body Only (Silver),Noisier than Fuji and evident compression artifacts.- Canon S95 quality is not in the same ballpark at high ISO and magnification; very rough.- iPhone5; like a juvenile delinquent in a class full of straight A students!Results at ISO 800:ISO 800 is my basic setting in daily photography.,CS,nothing
1337,1337,compression,20,12,6454472,B0092MD5UY,Fujifilm X-E1 16.3 MP Compact System Digital Camera with 2.8-Inch LCD - Body Only (Silver),"Most of the pics I have taken with the X-E1 HAVE been Moire pattern free however!As many sample pictures may seem, if you leave in camera sharpening set to zero, and Noise reduction to zero the jpegs tend to be a tad soft.",CS,P
1338,1338,compression,20,12,6454472,B0092MD5UY,Fujifilm X-E1 16.3 MP Compact System Digital Camera with 2.8-Inch LCD - Body Only (Silver),"For such small stuff like that, Silkypix is just fine..you can save the output as an uncompressed tiff file if you like, then finish up in LR or Photoshop or whatever graphic software you are more comfortable with..no worries!Two features I miss from the E-M5 vs the X-E1 are IN camera Pixel mapping, and the E-M5's GREAT 5 axis image stabilization.",CS,P
1339,1339,compression,20,12,6454486,B0092MD5UY,Fujifilm X-E1 16.3 MP Compact System Digital Camera with 2.8-Inch LCD - Body Only (Silver),"Workflow.. the RAW files are still poorly read by Lightroom and for some reason, they show a LOT more noise than the jpeg even though I had noise reduction turned off.",CS,N
1340,1340,compression,20,12,6481405,B0095F5AFG,Fujifilm XF1 12 MP Digital Camera with 3-Inch LCD (Brown),"If you opt to turn on RAW image recording however this slows down for example taking a 7 frame burst RAW + jpeg shot took the camera a few seconds to save the images off to the SD Card (I'm using a class 10 SD card for speed and I would recommend this as the minimum speed for this camera) during which time you cannot take any other pictures.On top of the XF1 are the tiny Fn button which by default provides quick access to the ISO speeds, but can be customised to suit your own needs from one of 10 different settings, a small but responsive shutter release button, a traditional shooting mode dial which is completely recessed within the top plate.The Fujifilm XF1 can record full high definition 1080p movies at 30fps with stereo sound and also several slow motion options at differing resolution going up to 200 frames per second but at a lowly 320 x 112 resolution.",CS,P
1341,1341,compression,20,12,6502457,B0096W1OCG,Sony NEX-6/B 16.1 MP Compact Interchangeable Lens Digital Camera with 3-Inch LED - Body Only (Black),To prolong it one can set LCD to Viewfinder only - use it to show parameters only and have live view /histogram in the EVF.JPEG image quality.,CS,nothing
1342,1342,compression,20,12,6502457,B0096W1OCG,Sony NEX-6/B 16.1 MP Compact Interchangeable Lens Digital Camera with 3-Inch LED - Body Only (Black),From this camera I expected clean out of camera JPEGs at ISO 1600.,SS,P
1343,1343,compression,20,12,6502457,B0096W1OCG,Sony NEX-6/B 16.1 MP Compact Interchangeable Lens Digital Camera with 3-Inch LED - Body Only (Black),-1* for jpeg processing.,SS,nothing
1344,1344,compression,20,12,6502457,B0096W1OCG,Sony NEX-6/B 16.1 MP Compact Interchangeable Lens Digital Camera with 3-Inch LED - Body Only (Black),Just a fair warning - don't expect stellar pics out of the box.The uploaded pic shows better dynamic range (understandably) of the APS-C sensor vs. smaller micro3/4 but the resolution (as out of the camera JPEG) is not even close to 2yr old G1 with very sharp kit 14-45mm or pancake 20/1.7.,CS,P
1345,1345,compression,20,12,6502457,B0096W1OCG,Sony NEX-6/B 16.1 MP Compact Interchangeable Lens Digital Camera with 3-Inch LED - Body Only (Black),"The handling is exceptional (looks like other people have no problems with the SD card port), JPEG quality at the base ISO100 no better than micro4/3 and visibly degrades with ISO increase, the hybrid AF is adequate but not on par with that of Nikon 1.",CS,P
1346,1346,compression,20,12,6502484,B0096W1OCG,Sony NEX-6/B 16.1 MP Compact Interchangeable Lens Digital Camera with 3-Inch LED - Body Only (Black),"Had to use different lenses of course (18-55mm zoom on Sony, 24-85mm zoom on Nikon, 18-55mm zoom on Fuji), and all shots were JPEGs, so this comparison does not make it possible to distinguish the relative contributions of sensors, lenses, jpeg processors.",CS,nothing
1347,1347,compression,20,12,6502484,B0096W1OCG,Sony NEX-6/B 16.1 MP Compact Interchangeable Lens Digital Camera with 3-Inch LED - Body Only (Black),"All pix were blown up to the screen equivalent of about 24"" wide.A word about JPEGs vs.",SS,nothing
