,Unnamed: 0,FeatureName,FeatureID,teamID,ReviewID,asin,title,Sentence,CS_SS,p/n
2009,2009,compression,20,11,6977726,B00AXTQQDS,Nikon D5200 24.1 MP CMOS Digital SLR Camera Body Only (Black),I understand because the special effects are processed that they have to be in JPEG.,SS,nothing
2010,2010,compression,20,11,6977726,B00AXTQQDS,Nikon D5200 24.1 MP CMOS Digital SLR Camera Body Only (Black),The issue is that when I want to shoot HDR I have to constantly go back to the menu and change to JPEG only.,CS,N
2011,2011,compression,20,11,6977726,B00AXTQQDS,Nikon D5200 24.1 MP CMOS Digital SLR Camera Body Only (Black),My question is: Can there be a Firmware Update that Can allow HDR be enabled when in RAW mode and then the camera only record JPEG as long as HDR is enabled?,CS,nothing
2012,2012,compression,20,11,6977726,B00AXTQQDS,Nikon D5200 24.1 MP CMOS Digital SLR Camera Body Only (Black),It is a pain to keep changing from RAW to JPEG every time I want to do a special effect.In the end I am constantly changing the settings of the camera and this takes a lot of time when I am shooting.,SS,N
2013,2013,compression,20,11,6977736,B00AXTQQDS,Nikon D5200 24.1 MP CMOS Digital SLR Camera Body Only (Black),"This gives what Nikon describes as ""professional-level performance"" from the 51 focus points (15 cross-type sensors), including speedy subject acquisition, and phase-detection AF down to a minimum luminance of -2 EV (really dark conditions).Using an EXPEED 3 image processor, the new camera has an ISO sensitivity of 100-6400 (expandable to 25600) and can shoot full resolution images at a not-too-shabby 6 fps, though the buffer capacity is only good for six frames in full 14-bit RAW (or 33 frames in JPEG fine and large).Interestingly, Nikon has also introduced a new 1.3x crop function which crops images, giving an extra telephoto effect - and taking it to about double the 35mm-format focal length.",CS,P
2014,2014,compression,20,11,6977760,B00AXTQQDS,Nikon D5200 24.1 MP CMOS Digital SLR Camera Body Only (Black),"It is a very very slow camera in low light, or when put into high resolution JPEG/RAW recording mode.",SS,N
2015,2015,compression,20,11,6983386,B00AY6MAY4,Nikon 1 J3 14.2 MP HD Digital Camera with 10-30mm VR 1 NIKKOR Lens (White),I will stick to JPEG since the image processor does a good job taming the noise in a visually pleasing way.,SS,P
2016,2016,compression,20,11,6983508,B00AY6Y1NC,Nikon COOLPIX S6500 Wi-Fi Digital Camera with 12x Zoom (Red),The blocky effect was probably from Nikon's choice to overcompress JPEGs.,SS,nothing
2017,2017,compression,20,11,7016430,B00B46A1A8,Pentax MX-1 12 MP Black Digital Camera with 4x Optical Image Stabilized Zoom and 3-Inch LCD Screen,"I'll touch on each.Pros:------ in good light, or in poorer light where you can place it on a stable base and adjust shutter speeds, or aperture, the MX-1 gives images in jpeg which are much closer to the aps-c sensor in my dslr than I expected.",CS,P
2018,2018,compression,20,11,7016433,B00B46A1A8,Pentax MX-1 12 MP Black Digital Camera with 4x Optical Image Stabilized Zoom and 3-Inch LCD Screen,"With my luck, the whole lens will fall out and invalidate any warranty.Considering the needs which I have for a camera, I set the camera to save to 9mb JPEG rather than RAW.",SS,N
2019,2019,compression,20,11,7016433,B00B46A1A8,Pentax MX-1 12 MP Black Digital Camera with 4x Optical Image Stabilized Zoom and 3-Inch LCD Screen,It's not RAW+JPEG.,SS,nothing
2020,2020,compression,20,11,7016433,B00B46A1A8,Pentax MX-1 12 MP Black Digital Camera with 4x Optical Image Stabilized Zoom and 3-Inch LCD Screen,"Perhaps they'll address it with a firmware fix, but I also notice there are no new firmwares on the Pentax site at all... Hopefully they'll not let this camera languish into oblivion.Because I prefer to save in JPEG and my post-processing is nil-to-none, I don't really need to use the included SilkyPix software.",CS,nothing
2021,2021,compression,20,11,7016447,B00B46A1A8,Pentax MX-1 12 MP Black Digital Camera with 4x Optical Image Stabilized Zoom and 3-Inch LCD Screen,"Also, sometimes I end up having to up the saturation just a little after importing RAW or JPEG.",CS,nothing
2022,2022,compression,20,11,7016473,B00B46A1A8,Pentax MX-1 12 MP Black Digital Camera with 4x Optical Image Stabilized Zoom and 3-Inch LCD Screen,The shot to shot times are decent for JPEG and RAW.,SS,P
2023,2023,compression,20,11,7016798,B00B46XRN6,Fujifilm FinePix F850EXR 16MP Digital Camera with 3-Inch LCD (Black),"Alamy, for example,  normally wants JPEG files,  minimum 24MB-48MB uncompressed in Photoshop, 8 bit depth, and upsizing is allowed only if done via Genuine Fractals.",CS,nothing
2024,2024,compression,20,11,7016815,B00B46XSDK,Fujifilm FinePix F900EXR 16MP Digital Camera with 3-Inch LCD (Black),"I took a class in Photoshop recently and the instructor explained the advantages of a raw file and said that all pros should shoot in raw.If you want to know about the raw file format and why I wanted this camera, just search on raw vs jpeg.I'm not a pro but I did want to have the flexibility that a raw file offered.",CS,P
2025,2025,compression,20,11,7028082,B00B5FL04E,Canon EOS M Compact System Camera,"With a 16gb sd card it can shoot 480 Raw + Large JPEG pics, but the battery probably won't last that long, more like 160 shots - but I am still playing around with it.Very happy with my first mirror-less camera, I never liked the bulkiness of DSLRs, just too much to carry around.",CS,P
2026,2026,compression,20,11,7028896,B00B5HE1SY,Canon PowerShot A2500 16MP Digital Camera with 5x Optical Image Stabilized Zoom with 2.7-Inch LCD (Black),"Maybe with time I'll learn to use it better, but compared to my older, cheaper Samsung, it 1) focuses more slowly; 2) occasionally focuses off; and 3) wont compress pictures sufficiently.",CS,P
2027,2027,compression,20,11,7028896,B00B5HE1SY,Canon PowerShot A2500 16MP Digital Camera with 5x Optical Image Stabilized Zoom with 2.7-Inch LCD (Black),How hard would it be to have a setting to compress JPEGs down to a point-and-shoot users' size on the SD card?,SS,N
2028,2028,compression,20,11,7028896,B00B5HE1SY,Canon PowerShot A2500 16MP Digital Camera with 5x Optical Image Stabilized Zoom with 2.7-Inch LCD (Black),Beware - even at half-resolution (8MP) and hgih compression files are nearly 3MB on disk.,SS,nothing
2029,2029,compression,20,11,7030050,B00B5HE3UU,Canon PowerShot ELPH 330 12.1MP Digital Camera with 10x Optical Image Stabilized Zoom with 3-Inch LCD (Black),Sony WX300 has a lot of noise (when you zoom in the details of the JPEG photo) and a lot of distortion.,SS,N
2030,2030,compression,20,11,7030086,B00B5HE3UU,Canon PowerShot ELPH 330 12.1MP Digital Camera with 10x Optical Image Stabilized Zoom with 3-Inch LCD (Black),"First, the camera goes dormant for a few seconds after the shutter is pushed, while the captured movie clip is compressed and concatenated onto the daily movie file.",CS,nothing
2031,2031,compression,20,11,7031819,B00B5P5XUG,Sigma C79900 DP3 Merrill Digital Camera with Foveon sensor and 3-Inch LCD Screen (Black),")Raw files only opens with horrible slow sigma pro software (I got away from the processing of raw files and love the JPEGS from X100s)If you print up to 20 x 30 you may not find much of any difference between x100s (you always get it right) and Sigma (if you get it right) (may be in crop it might stand better)Not good above 400 iso (except you can make decent BW prints with higher iso in NIK)PriceyBottom line:I am in  love with my X100s all over again, what a brillant camera.",CS,P
2032,2032,compression,20,11,7031819,B00B5P5XUG,Sigma C79900 DP3 Merrill Digital Camera with Foveon sensor and 3-Inch LCD Screen (Black),I am actually selling the prints off the X100s native JPEG files.I would wait for this to evolve and will look into this again in a couple of years when they address issuesWish list:OVFGrippy finish and make it less scratch proneFaster processorBetter ISOBetter / Bigger batteryMore pocketableDefinitely needs a better RAW processor OR better Lightroom support for RAW files,CS,P
2033,2033,compression,20,11,7033726,B00B660GE2,"Samsung WB250F 14.2MP CMOS Smart WiFi Digital Camera with 18x Optical Zoom, 3.0&quot;  Touch Screen LCD and 1080p HD Video (Gun Metal)","Both Still Images and Video are only in compressed formatsThat being said, the JPEG compression quality is fine for a point and shoot.",CS,P
2034,2034,compression,20,11,7033803,B00B660GE2,"Samsung WB250F 14.2MP CMOS Smart WiFi Digital Camera with 18x Optical Zoom, 3.0&quot;  Touch Screen LCD and 1080p HD Video (Gun Metal)",() The size of still-image files (jpeg) is between 4MB and 5MB.,SS,nothing
2035,2035,compression,20,11,7033989,B00B660GE2,"Samsung WB250F 14.2MP CMOS Smart WiFi Digital Camera with 18x Optical Zoom, 3.0&quot;  Touch Screen LCD and 1080p HD Video (Gun Metal)","This seems to work, although the picture file size was compressed in the process.I have not been able to use the WIFI auto-backup function, since this has a bug as well that causes timeout.",SS,P
2036,2036,compression,20,11,7036113,B00B728M5K,Pentax Optio WG-3 GPS purple 16 MP Waterproof Digital Camera with 3-Inch LCD Screen (Purple),"The pictures are of good quality although stored only in JPEG (no DNG, no RAW, bummer).",CS,P
2037,2037,compression,20,11,7042491,B00B7N9BRW,Nikon COOLPIX S9500 Wi-Fi Digital Camera with 22x Zoom and GPS (Black),"The camera is great until you reach the time to see the photo quality, compression!",SS,P
2038,2038,compression,20,11,7042491,B00B7N9BRW,Nikon COOLPIX S9500 Wi-Fi Digital Camera with 22x Zoom and GPS (Black),"the photo quality is compressed, didn't like it at all, why didn't I get me a canon or other brand, the S8400 was better but it had some dirt in the ccd compartment as well, why did I bought this?!",CS,P
2039,2039,compression,20,11,7042682,B00B7N9CB2,Nikon COOLPIX L28 20.1 MP Digital Camera with 5x Zoom Lens and 3&quot; LCD (Red),"It uses an AVI format with motion jpeg, but the bitrate is relatively slow.",SS,N
2040,2040,compression,20,11,7043261,B00B7N9CWG,Nikon COOLPIX L820 16 MP CMOS Digital Camera with 30x Zoom Lens and Full HD 1080p Video (Black),"Perspective, range, compression; all manner of photographic distortion occurs.",CS,N
2041,2041,compression,20,11,7043261,B00B7N9CWG,Nikon COOLPIX L820 16 MP CMOS Digital Camera with 30x Zoom Lens and Full HD 1080p Video (Black),"Now, let's speed through the compressed list of unbelievably excellent on this camera: 1080i 30fps video in full stereo.",SS,nothing
2042,2042,compression,20,11,7043599,B00B7O1CY6,Nikon COOLPIX P520 18.1 MP CMOS Digital Camera with 42x Zoom Lens and Full HD 1080p Video (Black),"For example, there's no RAW: your images are captured in JPEG only.",CS,nothing
2043,2043,compression,20,11,7043624,B00B7O1CY6,Nikon COOLPIX P520 18.1 MP CMOS Digital Camera with 42x Zoom Lens and Full HD 1080p Video (Black),"Some of the noise problem is the inferior jpeg compression used in the camera and to add insult to injury, there is no RAW image option.",CS,N
2044,2044,compression,20,11,7043705,B00B7O1CY6,Nikon COOLPIX P520 18.1 MP CMOS Digital Camera with 42x Zoom Lens and Full HD 1080p Video (Black),JPG compression is pretty high (4 and 8 times).,SS,P
2045,2045,compression,20,11,7043756,B00B7O2ZTW,Nikon COOLPIX P520 18.1 MP CMOS Digital Camera with 42x Zoom Lens and Full HD 1080p Video (Red),(The videos were compressed).,SS,nothing
2046,2046,compression,20,11,7052884,B00B8ZKN2Q,Pentax K-30 Digital Camera (Body Only) (Red),"The shiny red finish seems a little ""plasticy"" compared to the standard black.But when taking multiple large file, Raw + JPEG photos (my normal setup) the buffering seems quite adequate and the camera keeps up.",SS,P
2047,2047,compression,20,11,7078217,B00BD2QOEK,Canon EOS 6D Digital SLR Camera Body with EF 24-105mm L IS USM Lens with 64GB Card + Battery &amp; Charger + Battery Grip + 3 UV/FLD/CPL Filters + Remote Kit,"The SD card is a class 10 and seems to do well for raw, jpeg or video.",SS,P
2048,2048,compression,20,11,7083177,B00BEHQKPC,Sony DSC-WX300/R 18 MP Digital Camera with 20x Optical Image Stabilized Zoom and 3-Inch LCD (Red),But it is a JPEG image only camera.,CS,nothing
2049,2049,compression,20,11,7083245,B00BEHQKPC,Sony DSC-WX300/R 18 MP Digital Camera with 20x Optical Image Stabilized Zoom and 3-Inch LCD (Red),In the case of the Sony WX300 that file is a JPEG file.,SS,nothing
2050,2050,compression,20,11,7083449,B00BEHRQB4,Sony DSC-HX300/B 20 MP Digital Camera with 50x Optical Image Stabilized Zoom and 3-Inch LCD (Black),The quality of the jpegs can range from excellent to downright awful.,SS,nothing
2051,2051,compression,20,11,7083449,B00BEHRQB4,Sony DSC-HX300/B 20 MP Digital Camera with 50x Optical Image Stabilized Zoom and 3-Inch LCD (Black),"When the internal compression and processing is really off, the results range from a cartoonish effect to some portions of the photo appearing as if they were shot through a screen.",SS,N
2052,2052,compression,20,11,7083476,B00BEHRQB4,Sony DSC-HX300/B 20 MP Digital Camera with 50x Optical Image Stabilized Zoom and 3-Inch LCD (Black),"Unfortunately, the HX-300 at 80 ISO the JPEG images do have some processing artifacts in the form of  grainy structures, while edges are somewhat smeared rather than tack crisp under less-than-ideal conditions.",SS,nothing
2053,2053,compression,20,11,7087933,B00BF9MUAS,Sony NEX-3NL/W Compact Interchangeable Lens Digital Camera Kit (White),The included lens is best for JPEG shooters.,CS,P
2054,2054,compression,20,11,7087933,B00BF9MUAS,Sony NEX-3NL/W Compact Interchangeable Lens Digital Camera Kit (White),"This isn't a show stopper, but if you compose a lot of image in low light it can be very distracting.The lens performs well enough in JPEG, but is largely corrected in software.",SS,P
2055,2055,compression,20,11,7087991,B00BF9MUAS,Sony NEX-3NL/W Compact Interchangeable Lens Digital Camera Kit (White),"The Superior Auto mode is a large part of what bumps this camera up to 5-star performance.+ Easy zoom+ Quality choices - Standard, Fine, Raw or Raw & JPEG+ Image Size - L 16M, M 8.4M, S 4.0M+ On-screen tips/user guide, just press the question mark and it will explain a feature for you or give you tips and lessons on how to get better results.+ Very simple to enter and exit movie mode with the thumb button feature on the back right+ Sweep Panorama mode+ Scene Selection mode - Macro, Landscape, Portrait, Anti-motion Blur, Hand-held Twilight, Night scene, Night Portrait, Sunset, Sports Action+ High-quality, full-color display+ Simple to use flash+ Comes with a full manual- Lack of viewfinder.",CS,nothing
2056,2056,compression,20,11,7088014,B00BF9MUAS,Sony NEX-3NL/W Compact Interchangeable Lens Digital Camera Kit (White),It also renders JPEGs well in my opinion which is important to those who will never bother with the post processing they images.,SS,P
2057,2057,compression,20,11,7088070,B00BF9MVMK,"Sony SLT-A58K Digital SLR Kit with 18-55mm Zoom Lens, 20.1MP SLR Camera with 2.7 -Inch LCD Screen (Black)",The JPEG image quality is the best I have seen on an Alpha camera to date.,CS,P
2058,2058,compression,20,11,7088070,B00BF9MVMK,"Sony SLT-A58K Digital SLR Kit with 18-55mm Zoom Lens, 20.1MP SLR Camera with 2.7 -Inch LCD Screen (Black)",Sony finally tweaked the JPEG engine for better results.3.,CS,P
2059,2059,compression,20,11,7114980,B00BI9X7UC,Nikon D7100 24.1 MP DX-Format CMOS Digital SLR (Body Only),"So i set up on a tripod the same shot with each card at 14bit RAW uncompressed, as many as the camera take in 30 seconds.",SS,nothing
2060,2060,compression,20,11,7114986,B00BI9X7UC,Nikon D7100 24.1 MP DX-Format CMOS Digital SLR (Body Only),"This would even make a good backup camera for a professional photographer.For people like me who just do this for fun and shoot JPEG, there is a lot of retouching that can be done in the retouch menu such as trim, color balance, resize, straighten.",CS,P
2061,2061,compression,20,11,7114986,B00BI9X7UC,Nikon D7100 24.1 MP DX-Format CMOS Digital SLR (Body Only),"1) first card for RAW and second for JPEG, 2) second card is used as a duplicate of the first, 3) second card is used for overflow if the first card gets filled up.",CS,nothing
2062,2062,compression,20,11,7114986,B00BI9X7UC,Nikon D7100 24.1 MP DX-Format CMOS Digital SLR (Body Only),I do wish this one had built-in wi-fi and that HDR mode worked in RAW too and not just JPEG.,SS,P
2063,2063,compression,20,11,7114995,B00BI9X7UC,Nikon D7100 24.1 MP DX-Format CMOS Digital SLR (Body Only),"Wheather this D7100 is used in RAW or jpeg the other cameras are just as good, less expensive and some are even sharper.",CS,P
2064,2064,compression,20,11,7115006,B00BI9X7UC,Nikon D7100 24.1 MP DX-Format CMOS Digital SLR (Body Only),I use a 35mm lens for mostly everything as I am shooting high quality JPEG on card one and RAW on card two.,SS,nothing
2065,2065,compression,20,11,7115007,B00BI9X7UC,Nikon D7100 24.1 MP DX-Format CMOS Digital SLR (Body Only),Just shoot JPEG for better performance.Unlike the D5200 I won't complain about the lack of touchscreen because this camera provides easy access to controls.,CS,nothing
2066,2066,compression,20,11,7115016,B00BI9X7UC,Nikon D7100 24.1 MP DX-Format CMOS Digital SLR (Body Only),They must be compressed to save space.,SS,nothing
2067,2067,compression,20,11,7115019,B00BI9X7UC,Nikon D7100 24.1 MP DX-Format CMOS Digital SLR (Body Only),"The D7100 has 2 SDHC card slots, so you can record RAW on the first card and JPEG on the second.",CS,nothing
2068,2068,compression,20,11,7115019,B00BI9X7UC,Nikon D7100 24.1 MP DX-Format CMOS Digital SLR (Body Only),Nice!Now for the down side - it only shoots RAW and JPEG - unlike the D300s which will also shoot TIF's.,CS,nothing
2069,2069,compression,20,11,7115024,B00BI9X7UC,Nikon D7100 24.1 MP DX-Format CMOS Digital SLR (Body Only),"I have mine set to RAW/JPEG but can always change it to copy/backup or simply double the memory, which now days can give rediculous results.",CS,nothing
2070,2070,compression,20,11,7115030,B00BI9X7UC,Nikon D7100 24.1 MP DX-Format CMOS Digital SLR (Body Only),"I upgraded from the D7000 to the D7100 because I wanted more pixels, but if you use JPEG the camera tries to to get rid of noise with processing (even at ISO100) and give you really soft images, if you use RAW you get more pixels allright, but you also get a LOT MORE NOISE, SO FOR ME, UPGRADING FROM THE D7000 HAS BEEN A HUGE WASTE, paid a lot for the same I would have gotten with a d7000.Then another problem, with ISO800 for instance, the D7000 did GREAT with Dynamic Range, but with the D7100 the dynamic range at ISO800 the Dynamic Range Drops to the same of a damn cellphone!!",CS,nothing
2071,2071,compression,20,11,7115064,B00BI9X7UC,Nikon D7100 24.1 MP DX-Format CMOS Digital SLR (Body Only),"So, from this perspective, unfortunately I I do have 3 major issues with D7100 and I would give it 3 stars.1)  Small buffer size: Apparently, the advertised 6 fps or 7fps (cropped mode) is probably feasible if you shoot in JPEG.",SS,N
2072,2072,compression,20,11,7115072,B00BI9X7UC,Nikon D7100 24.1 MP DX-Format CMOS Digital SLR (Body Only),"Of course the pictures look ""oh my god"" sharper when you print them since they have twice as many pixels per unit area on paper.I shoot 14-bit raw images with loseless compress and rarely use the 1.3 crop mode though I've mapped crop mode to one of the external buttons.",CS,P
2073,2073,compression,20,11,7115073,B00BI9X7UC,Nikon D7100 24.1 MP DX-Format CMOS Digital SLR (Body Only),"Using NX2, you can do some crude editing (adequate for some, perhaps) and can convert to jpegs or 8/16 bit tiffs.",SS,nothing
2074,2074,compression,20,11,7115073,B00BI9X7UC,Nikon D7100 24.1 MP DX-Format CMOS Digital SLR (Body Only),"You'd be limited to converting to jpeg or tiff using Nikon ViewNX2, as shown in some of my images above.UPDATE later 4/3/13: Adobe DNG Converter v7.4 and Lightroom v4.4 now support the D7100",SS,nothing
2075,2075,compression,20,11,7115083,B00BI9X7UC,Nikon D7100 24.1 MP DX-Format CMOS Digital SLR (Body Only),from JPEG to RAW and back again) for no apparent reason.,SS,nothing
2076,2076,compression,20,11,7115147,B00BI9X7UC,Nikon D7100 24.1 MP DX-Format CMOS Digital SLR (Body Only),"Its speeds up the process so much.As for the files I have not even bothered with jpeg, shooting in RAW the whole time.",SS,N
2077,2077,compression,20,11,7115156,B00BI9X7UC,Nikon D7100 24.1 MP DX-Format CMOS Digital SLR (Body Only),Unless you have a very pointed reason too - the heck with JPEGs.,SS,N
2078,2078,compression,20,11,7115173,B00BI9X7UC,Nikon D7100 24.1 MP DX-Format CMOS Digital SLR (Body Only),"On 24Mpix (DX Image Area, see point 1), it becomes noticeably slower (I always shoot RAW uncompressed + Jpeg Fine).",CS,N
2079,2079,compression,20,11,7115235,B00BI9X7UC,Nikon D7100 24.1 MP DX-Format CMOS Digital SLR (Body Only),The quibbles - files are so large when using maximum quality (RAW + JPEG) that it takes a long time to write from the card to the computer.,SS,N
2080,2080,compression,20,11,7115239,B00BI9X7UC,Nikon D7100 24.1 MP DX-Format CMOS Digital SLR (Body Only),RAW images were always captured at 12-bit (lossless compressed RAW 12-bit) even though the camera was set at lossless compressed 14-bit2.,SS,nothing
2081,2081,compression,20,11,7115239,B00BI9X7UC,Nikon D7100 24.1 MP DX-Format CMOS Digital SLR (Body Only),"RAW image's size was always at 1620x1080 @12-bit no matter which Image Quality option was chosen (NEF+JPEG fine, NEF+JPEG normal, NEF+JPEG basic, NEF)3.",SS,P
2082,2082,compression,20,11,7115239,B00BI9X7UC,Nikon D7100 24.1 MP DX-Format CMOS Digital SLR (Body Only),JPEG images were recorded at 6000x4000 @8-bit (Large)I used latest Nikon Capture NX2 version 2.4.1 and Nikon View NX2 version 2.0.2RAW images from Nikon D7000 were reported correctly using these same Nikon Capture/View NX2 software.,CS,P
2083,2083,compression,20,11,7115239,B00BI9X7UC,Nikon D7100 24.1 MP DX-Format CMOS Digital SLR (Body Only),"In other words, D7000's raw images were properly recorded at 4928x3264 (L), lossless compressed RAW 14-bitHave anyone seen/had this problem with Nikon D7100?I wonder if my D7100 were a defected one.",SS,P
2084,2084,compression,20,11,7115254,B00BI9X7UC,Nikon D7100 24.1 MP DX-Format CMOS Digital SLR (Body Only),Shooting JPEG for sports will help with this issue for sports and action photographers.,SS,N
2085,2085,compression,20,11,7115254,B00BI9X7UC,Nikon D7100 24.1 MP DX-Format CMOS Digital SLR (Body Only),I personally shoot RAW with normal JPEG as back up.I love this camera and would suggest going to a camera shop and getting one in your hands.,SS,P
2086,2086,compression,20,11,7115262,B00BI9X7UC,Nikon D7100 24.1 MP DX-Format CMOS Digital SLR (Body Only),"Also I have read that the banding only comes out if RAW pictures are pushed +3 EV or more, which I would obviously would not be doing.Wrong.Banding comes out randomly, even on JPEGs, if the Automatic D-Lighting is on (I always had this on on all the NIKONs I owned).",CS,N
2087,2087,compression,20,11,7115268,B00BI9X7UC,Nikon D7100 24.1 MP DX-Format CMOS Digital SLR (Body Only),"Furthermore, JPEG images more grainy than D7000.",CS,N
2088,2088,compression,20,11,7115275,B00BI9X7UC,Nikon D7100 24.1 MP DX-Format CMOS Digital SLR (Body Only),If you are trying to capture sports action you won't like the buffer unless you shoot in JPEG only.Happy with this purchase.,CS,P
2089,2089,compression,20,11,7115281,B00BI9X7UC,Nikon D7100 24.1 MP DX-Format CMOS Digital SLR (Body Only),"The buffer is more than adequate if you are shooting JPEG's as I do, especially for sports.",CS,P
2090,2090,compression,20,11,7115287,B00BI9X7UC,Nikon D7100 24.1 MP DX-Format CMOS Digital SLR (Body Only),USE A SanDisk Extreme Pro 32 GB SDHC Class 10 UHS-1 Flash Memory Card 95MB/s WITH IT & BURST MODE WILL SHOOT ALL DAY SHOOTING FINE JPEG.,SS,nothing
2091,2091,compression,20,11,7115315,B00BI9X7UC,Nikon D7100 24.1 MP DX-Format CMOS Digital SLR (Body Only),"Knowing that shortcoming, I shot RAW+JPEG all week so I could still get them into LR and get the photos out to clients.If you are looking for an excellent camera for DSLR photography and don't want to make the plunge in FX format.",CS,nothing
2092,2092,compression,20,11,7115345,B00BI9X7UC,Nikon D7100 24.1 MP DX-Format CMOS Digital SLR (Body Only),"If you've been hemming and hawing about upgrading an aging consumer or prosumer Nikon camera, now is a great time to do so!I'm currently using two Transcend 32GB class 10 memory cards and have not noticed any slowness shooting photos (RAW+JPEG) or 1080 video.Pros:- I'm coming from a D70s, so I like most everything about this camera.- All the extra options.",CS,P
2093,2093,compression,20,11,7131493,B00BM8O6X6,"Nikon COOLPIX S9500 18.1 MP Digital Camera with 22x Zoom and Built-In Wi-Fi (Black) Super Bundle Includes 16GB Memory Card, Lithium Replacement Battery, Mini Table-top Tripod, Deluxe Carrying Case , and 3pc. Lens Cleaning Kit.","Locks up electronically, have to remove battery to restart, happens often.image quality seems to be effected by high compression ratio.",SS,nothing
2094,2094,compression,20,11,7131676,B00BM9BNYK,"Sony DSC-HX300/B DSCHX300V DSC-HX300V Black Digital Camera 32GB Bundle - Includes 32 GB SDHC Memory Card - Class 10, Special DVD Guide to Digital Photography Compact Gadget Bag, NP-BX1 1600MAH Battery Pack, AC/DC Battery Charger + More","I do miss being able to shoot in RAW, but the 20.1 MP Jpeg images are generally exceptionally crisp.",SS,P
2095,2095,compression,20,11,7134250,B00BMTW9CK,Samsung NX1000 Mirrorless Wi-Fi Digital Camera with 20-50mm Lens (Black) - EV-NX1000BABUS,Sharpness is good in JPEGs (I have not shot RAW yet) and tones are nice and smooth (think large expanses of blue sky and clouds).,SS,P
