,Unnamed: 0,FeatureName,FeatureID,teamID,ReviewID,asin,title,Sentence,CS_SS,p/n
640,640,compression,20,12,1428284,B000V5P90K,Canon EOS 40D 10.1MP Digital SLR Camera (Body Only),raw files are bo better then jpegs as long as you know how to adjust your camera everything you can do with raw you can do in camera.,SS,P
641,641,compression,20,12,1428284,B000V5P90K,Canon EOS 40D 10.1MP Digital SLR Camera (Body Only),i have never regretted shooting jpeg only except when i get hate mail from raw shoots cursing my life.,CS,N
642,642,compression,20,12,1624483,B0012Y6HC8,Canon Digital Rebel XSI 12.2 MP Digital SLR Camera with EF-S 18-55mm f/3.5-5.6 IS Lens (Silver),I usually have it set to full manual and on RAW + JPEG.,SS,nothing
643,643,compression,20,12,1970014,B001ENOZY4,Nikon D90 12.3MP DX-Format CMOS Digital SLR Camera with 18-105 mm f/3.5-5.6G ED AF-S VR DX Nikkor Zoom Lens,"One thing about the D7000 in comparison, is the file size is much bigger (I shoot hi JPEG and RAW combined).",CS,nothing
644,644,compression,20,12,1973476,B001EQ4BVI,Canon EOS 50D DSLR Camera (Body Only),(1) You can shoot up to 12400 ISO in jpeg mode.,SS,nothing
645,645,compression,20,12,2031708,B001G5ZTLS,Canon EOS 5D Mark II Full Frame DSLR Camera (Body Only) (OLD MODEL),"With wide-aperture lenses, you'll be dead-on with manual focus every time.In terms of post-processing flexibility, Canon EOS video is like shooting JPEG, but worse because the H.264 video codec throws away even more unseen data.",CS,P
646,646,compression,20,12,2031708,B001G5ZTLS,Canon EOS 5D Mark II Full Frame DSLR Camera (Body Only) (OLD MODEL),Your call whether that's worth five times the price.SETTINGS:Some settings only affect JPEG images.,CS,P
647,647,compression,20,12,2031751,B001G5ZTLS,Canon EOS 5D Mark II Full Frame DSLR Camera (Body Only) (OLD MODEL),"High resolution, simple menu, light, user friendly; shoot jpeg or RAW with better lenses and you can print big.",CS,P
648,648,compression,20,12,2388505,B001WAKSCW,Panasonic DMC-GH1K 12.1MP Four Thirds Interchangeable Lens Camera with 1080p HD Video,"For those like myself that wanted to take my photography further, the control is limitless with what you can manually adjust as well allowing me to really improve my pictures and my abilities as well as learning the digital photography art more thoroghly.The video capability is way beyond mine, I have produced some effortless clips and stunning short legnth videos, but my knowledge is less than enough to accurately review its ability other than it made me look like I kneew what I was doing with the simple push of the designated video button, and easy editing on myApple MacBook Pro MD313LL/A 13.3-Inch Laptop (NEWEST VERSION)It is fast accurate bright and simple to produce great video in my opinion and with the firmware hack mentioned earlier this body is condidered by many to be a professional grade portable system.I'll cut this off with some bullet points:+size+battery life+image capture speed+availability of lens for all situations+ease of use+ability to maually control the camera and produce stunning images+HD video ability beyond almost all other system cameras+SD card compatibility+iA mode will make 99% of the users feel like they can take pictures with confidence+RAW and jpeg file capture for post processing and easy sharing of file in high resolution-lens expense-no in camera image stabilization (panasonic lens has IS where needed)-low light performance with kit lens 14-140mm and 14-45/42mm (overcome by additional lens purchase)-single card slot for those busier daysI highly recomend this camera still 3 years later, and for the novice or the experienced this camera will not dissappoint, being 3 years old now it is much less expensive and the lens offerings make it an even better camera than it was the day I bought it.",CS,P
649,649,compression,20,12,2648036,B002JCSV6M,Nikon D300S 12.3MP DX-Format CMOS Digital SLR Camera with 3.0-Inch LCD (Body Only),I have loved this camera and it has allowed me to grow as a photographer due to it's quality and ability to shoot in RAW format and combined RAW & JPEG at the same time.,SS,P
650,650,compression,20,12,2663828,B002KANX2A,Nikon Coolpix S570 12MP Digital Camera with 5x Wide Angle Optical Vibration Reduction (VR) Zoom and 2.7-Inch LCD (Pink),"I tried all the recommended fixes (gently tapping the front, compressed air to blow out around the lens).",CS,nothing
651,651,compression,20,12,2687664,B002LITT3I,Canon PowerShot SX20IS 12.1MP Digital Camera with 20x Wide Angle Optical Image Stabilized Zoom and 2.5-Inch Articulating LCD,"It's a modern enough camera that there's not much excuse for being confined to JPEG, and I am disappointed by this, however the quality of the JPEGs is still high enough that it is no kind of deal-breaker for me.",SS,nothing
652,652,compression,20,12,2688102,B002LITT42,Canon PowerShot S90 10MP Digital Camera with 3.8x Wide Angle Optical Image Stabilized Zoom and 3-Inch LCD,"So I very carefully opened up the camera myself, located the sensor and used compressed air to clean the sensor myself.",SS,P
653,653,compression,20,12,2732284,B002NEGTTW,"Canon EOS 7D 18 MP CMOS Digital SLR Camera, Body Only (DISCONTINUED)","Some people have indicated they were not happy with the sharpness - I adjusted the sharpness setting up a bit (if you want jpeg) in the standard mode, and it seemed to make a difference.",SS,P
654,654,compression,20,12,2732412,B002NEGTTW,"Canon EOS 7D 18 MP CMOS Digital SLR Camera, Body Only (DISCONTINUED)",i shoot all jpeg all the time.,CS,nothing
655,655,compression,20,12,2732412,B002NEGTTW,"Canon EOS 7D 18 MP CMOS Digital SLR Camera, Body Only (DISCONTINUED)",unless you tell people you shoot jpeg only then they will devote sites to hating you.,CS,N
656,656,compression,20,12,2732412,B002NEGTTW,"Canon EOS 7D 18 MP CMOS Digital SLR Camera, Body Only (DISCONTINUED)",look at ken rockwell he only shoots jpeg and there are a mess load of hate sites out about him shooting jpeg.,CS,N
657,657,compression,20,12,2732412,B002NEGTTW,"Canon EOS 7D 18 MP CMOS Digital SLR Camera, Body Only (DISCONTINUED)",all im saying is that the 7d alond with most cameras are so good and so adjustable that you can get great jpegs out of all the new cameras.,CS,P
658,658,compression,20,12,2732412,B002NEGTTW,"Canon EOS 7D 18 MP CMOS Digital SLR Camera, Body Only (DISCONTINUED)",people who say that there raws are better is because they are comparing them to a jped from a camera they dont know how to adjust so of course for them its a fact that raw makes better pictures then jpeg.,CS,P
659,659,compression,20,12,2732412,B002NEGTTW,"Canon EOS 7D 18 MP CMOS Digital SLR Camera, Body Only (DISCONTINUED)",if your a camera man a real photographer you shoot jpeg.,SS,nothing
660,660,compression,20,12,2732466,B002NEGTTW,"Canon EOS 7D 18 MP CMOS Digital SLR Camera, Body Only (DISCONTINUED)","This to me is probably the most important, even before image quality.- The sensor gives beautiful, vibrant images - the color rendering is very close to what I see with my eyes, which is my criterion.- The sensor also features a native ISO range of up to 6400 and at ISO 3200 the pictures are really good.- Flash control is excellent - I frequently use the remote flash control from the camera with a 580Ex-II and a 430Ex-II together and the possibilities are staggering.- The JPEG you get directly from the camera are gorgeous.",CS,P
661,661,compression,20,12,2732466,B002NEGTTW,"Canon EOS 7D 18 MP CMOS Digital SLR Camera, Body Only (DISCONTINUED)","I rarely shoot raw due to the size of the resulting files except when doing landscape or portrait, and the dedicated button that switches to raw+JPEG for the next picture is very useful to me.There are many more good things to say about this camera but I would find myself re-writing the manual, which is informative, well written and well-worth reading from cover to cover.All in all a great camera, the best I ever had and one of the easiest to use.",CS,P
662,662,compression,20,12,2732527,B002NEGTTW,"Canon EOS 7D 18 MP CMOS Digital SLR Camera, Body Only (DISCONTINUED)",The last updated increased its RAW and RAW+JPEG buffer and added manual audio adjustment.Happy shooting!,CS,nothing
663,663,compression,20,12,2835199,B002SQKVD0,Nikon D3S 12.1 MP CMOS Digital SLR Camera with 3.0-Inch LCD and 24fps 720p HD Video Capability (Body Only),I can get over 600 images RAW 14-bit Lossless compressed shots on a 16GB Sandisk Ultra CF card.,SS,nothing
664,664,compression,20,12,3007816,B0031RGGFM,Kodak Easyshare Z981 14 MP Digital Camera with Schneider-Kreuznach Variogon 26xWide Angle Optical Image Stabilized Zoom Lens and 3.0-Inch LCD Sreen,"It will choose an ISO for you, as well as shutter speed, aperture, flash, and then use in-camera JPG compression and noise reduction.",CS,nothing
665,665,compression,20,12,3007816,B0031RGGFM,Kodak Easyshare Z981 14 MP Digital Camera with Schneider-Kreuznach Variogon 26xWide Angle Optical Image Stabilized Zoom Lens and 3.0-Inch LCD Sreen,"You've got the date and time, the shot numbers in series, the ISO, shutter speed, f-stop, exposure compensation, use of flash, compression, contrast, color and sharpness settings-- and you're complaining?",CS,N
666,666,compression,20,12,3007816,B0031RGGFM,Kodak Easyshare Z981 14 MP Digital Camera with Schneider-Kreuznach Variogon 26xWide Angle Optical Image Stabilized Zoom Lens and 3.0-Inch LCD Sreen,?RAW/KDC in the Z981: The 'Fine' JPG compression isn't fine-- images are blotchy and pasty-looking when examined closely at all.,CS,nothing
667,667,compression,20,12,3007816,B0031RGGFM,Kodak Easyshare Z981 14 MP Digital Camera with Schneider-Kreuznach Variogon 26xWide Angle Optical Image Stabilized Zoom Lens and 3.0-Inch LCD Sreen,"Judging by comparison with the results of third-party software, noise reduction is automatically added along with JPG compression.",SS,N
668,668,compression,20,12,3007816,B0031RGGFM,Kodak Easyshare Z981 14 MP Digital Camera with Schneider-Kreuznach Variogon 26xWide Angle Optical Image Stabilized Zoom Lens and 3.0-Inch LCD Sreen,"Using third-party software to make JPG's is the way to go: With only 2% compression in PSPX4, I was able to shrink a RAW/KDC file from 25 MB down to 12MB with no noticeable image degradation, even at pixellated magnifications.",CS,N
669,669,compression,20,12,3007816,B0031RGGFM,Kodak Easyshare Z981 14 MP Digital Camera with Schneider-Kreuznach Variogon 26xWide Angle Optical Image Stabilized Zoom Lens and 3.0-Inch LCD Sreen,"Even a 10% compression ratio still looked good, and gave about a 4MB file size.",SS,P
670,670,compression,20,12,3007816,B0031RGGFM,Kodak Easyshare Z981 14 MP Digital Camera with Schneider-Kreuznach Variogon 26xWide Angle Optical Image Stabilized Zoom Lens and 3.0-Inch LCD Sreen,"That means carrying a tripod, but you should anyway.You can get some amazing shots out of the Z981, but you'll have to work within its shortcomings.Pluses:1) Records good HD video2) Has an EVF and a large, bright LCD3) Amazing zoom and macro range4) Low chromatic aberration5) High quality images possible at ISO 64 and 1006) Uses AA batteries instead of proprietaries7) Low price-- you still get a lot, even with the minuses8) Has the usual tricks for photo manipulation, from face recognition and scene presets to black and white and sepia imaging9) A decent 'point and shoot' snapshot camera, except for its sizeMinuses:1) Digital noise gets pretty bad by ISO 2002) Blurred edges from mid to max zoom3) Only 3 f-stops at best, 1.3 at worst4) Little depth of field5) Battery life is short6) AF issues-- sometimes it can't focus7) Even 'Fine' JPG compression looks bad-- at all ISO's8) No real manual focus, and the motorized manual focus is not easy to use9) No thread to mount filters, etc.10) Rather useless 'Keyword Tag' function11) Too large for a point and shoot/pocket camera",CS,P
671,671,compression,20,12,3025498,B0032JRRWK,Canon PowerShot A3000 IS 10 MP Digital Camera with 4x Optical Image Stabilized Zoom and 2.7-Inch LCD,"Please keep in mind that the images posted by Amazon are compressed and do not represent the images in their highest detail, even so, they are quite acceptable.",CS,nothing
672,672,compression,20,12,3052193,B0034XFG86,Nikon Coolpix P100 10 MP Digital Camera with 26x Optical Vibration Reduction (VR) Zoom and 3-Inch LCD (Black),"The gantrys we have aren't all tall enough to see over them with, so I have to rely on the tilting screen.The ability of this camera to get closeup photos of small details is also invaluable, as part of my job entails catching the tiniest flaws in the inner workings of the engine, such as nicks on the compressor blades.",CS,P
673,673,compression,20,12,3052194,B0034XFG86,Nikon Coolpix P100 10 MP Digital Camera with 26x Optical Vibration Reduction (VR) Zoom and 3-Inch LCD (Black),"Indoors without flash in any lighting, especially diffuse sunlight gives photos a pink cast that cannot be removed from the jpeg file.",SS,nothing
674,674,compression,20,12,3052194,B0034XFG86,Nikon Coolpix P100 10 MP Digital Camera with 26x Optical Vibration Reduction (VR) Zoom and 3-Inch LCD (Black),Detail in distant foliage is non-existent - the noise reduction and jpeg compression smudge all detail.5.,CS,N
675,675,compression,20,12,3066996,B0035FZJHQ,Canon EOS Rebel T2i DSLR Camera with EF-S 18-55mm f/3.5-5.6 IS Lens (OLD MODEL),Shooting JPEG only I can hold the shutter release and the camera flies - taking shot after shot.,CS,nothing
676,676,compression,20,12,3066996,B0035FZJHQ,Canon EOS Rebel T2i DSLR Camera with EF-S 18-55mm f/3.5-5.6 IS Lens (OLD MODEL),"JPEG + RAW definitely slows it down but unless you are going to be shooting a lot of sports, this won't be a problem.",SS,N
677,677,compression,20,12,3066996,B0035FZJHQ,Canon EOS Rebel T2i DSLR Camera with EF-S 18-55mm f/3.5-5.6 IS Lens (OLD MODEL),"If you are and can keep it in JPEG, you will be fine.Quality of the pictures is fantastic.",SS,P
678,678,compression,20,12,3067259,B0035FZJHQ,Canon EOS Rebel T2i DSLR Camera with EF-S 18-55mm f/3.5-5.6 IS Lens (OLD MODEL),Regular JPEG images are about 5-6 MB each.I thought the buttons were of lower quality than the Rebel XS.,CS,nothing
679,679,compression,20,12,3074291,B0035LBRJO,Olympus PEN E-PL1 12.3MP Live MOS Micro Four Thirds Interchangeable Lens Digital Camera with 14-42mm f/3.5-5.6 Zuiko Digital Zoom Lens (Black),"This can be qutie distracting, and if you plan on doing a lot of recording, the Olympus SEMA-1 external mic adapter is highly recommended, as it should isolate the mic from the lens motor and solve this problem - this will be my next purchase**.2) The video sizes in the Motion-jpeg/AVI format are HUUGE.",SS,N
680,680,compression,20,12,3074291,B0035LBRJO,Olympus PEN E-PL1 12.3MP Live MOS Micro Four Thirds Interchangeable Lens Digital Camera with 14-42mm f/3.5-5.6 Zuiko Digital Zoom Lens (Black),"The good news is that the video compresses down quite nicely to more familiar and compatible formats without much loss in quality - I used Handbrake to compress this video from 750 down to 310 MB in size, with a negligible-to-nil difference in quality (h.264 format, High Profile with Constant Quality set to RF 15 and audio set to pass-through).",CS,P
681,681,compression,20,12,3074298,B0035LBRJO,Olympus PEN E-PL1 12.3MP Live MOS Micro Four Thirds Interchangeable Lens Digital Camera with 14-42mm f/3.5-5.6 Zuiko Digital Zoom Lens (Black),"Amazing Jpegs--forget RAW (embarrassed to admit it), the jpegs on this are so beautiful--no need to post process.",SS,P
682,682,compression,20,12,3074339,B0035LBRJO,Olympus PEN E-PL1 12.3MP Live MOS Micro Four Thirds Interchangeable Lens Digital Camera with 14-42mm f/3.5-5.6 Zuiko Digital Zoom Lens (Black),The high res JPEG is excellent.,SS,P
683,683,compression,20,12,3074476,B0035LBRJO,Olympus PEN E-PL1 12.3MP Live MOS Micro Four Thirds Interchangeable Lens Digital Camera with 14-42mm f/3.5-5.6 Zuiko Digital Zoom Lens (Black),"You can also configure sharpening, color, etc  ...- Jpegs are greats.- Image stabilization is independent of the lens: it can be used with legacy manual film lenses.",SS,nothing
684,684,compression,20,12,3074514,B0035LBRJO,Olympus PEN E-PL1 12.3MP Live MOS Micro Four Thirds Interchangeable Lens Digital Camera with 14-42mm f/3.5-5.6 Zuiko Digital Zoom Lens (Black),"My son compressed it some in after effects so I didn't do a great job of showing its clarity, but you can hear some of the focusing and see the overall low light performance.",CS,P
685,685,compression,20,12,3099509,B0036RDP9C,Samsung TL350 10.0 MP 5x Optical Zoom Digital Camera (Black),"mp count, Jpeg vs RAW, EV, AWB, metering, etc) more detailed full menu.",CS,nothing
686,686,compression,20,12,3128625,B0037VVWBK,OLYMPUS 262855 12.3 Megapixel E-PL1 Pen Camera (Black camera body),I usually shoot raw but the jpeg in this camera really are nice.,SS,P
687,687,compression,20,12,3128626,B0037VVWBK,OLYMPUS 262855 12.3 Megapixel E-PL1 Pen Camera (Black camera body),I assigned custom white balance function to Fn button and RAW+JPEG function to video record button.,SS,nothing
688,688,compression,20,12,3162742,B00395YA6S,Panasonic Lumix DMC-ZR3 14.1 MP Digital Camera with 8x Optical Image Stabilized Zoom and 2.7-Inch LCD (Blue),"None of these camera capture in RAW, minimally processed format that more interested photo-shoppers might prefer, saving the files in JPEG compressed format.",CS,P
689,689,compression,20,12,3286292,B003E47FWU,"Polaroid CIM-1237R 12 MP Digital Camera with 3x Optical Zoom, Red","Maybe that's normal for digital cameras.Using only the internal memory (no separate memory card) and with JPEG compression set to Normal, I'm getting about 28 photos at 3 megapixel size before memory is full.",CS,nothing
690,690,compression,20,12,3286357,B003E47XR2,Olympus PEN E-P2 Micro 4/3 Digital Camera Body (Black),"The jpeg output is exceptional, and the IS really saves a lot of shots.",SS,P
691,691,compression,20,12,3401835,B003K230GQ,Reconyx HyperFire Infrared Digital Game Camera HC600,"But megapixels is only one factor in image quality, and usually only if you are going to do alot of photo editing on the jpeg images or if you are going to produce large prints.",CS,nothing
692,692,compression,20,12,3479411,B003NRACM8,EOS 5D Mark II 21.1MP Full Frame CMOS Digital SLR Camera (Canon USA) (Body),"With wide-aperture lenses, you'll be dead-on with manual focus every time.In terms of post-processing flexibility, Canon EOS video is like shooting JPEG, but worse because the H.264 video codec throws away even more unseen data.",CS,P
693,693,compression,20,12,3479411,B003NRACM8,EOS 5D Mark II 21.1MP Full Frame CMOS Digital SLR Camera (Canon USA) (Body),Your call whether that's worth five times the price.SETTINGS:Some settings only affect JPEG images.,CS,P
694,694,compression,20,12,3485085,B003NYRMGA,Panasonic LUMIX DMC-ZS6 12.1 MP DIGITAL CAMERA BLACK - 3.0 &quot; TFT Screen LCD Display!!,"The forum suggestions to blow compressed air inside the slot, clean the points with alcohol, try a new card and turn it on/off did not work for myself or the others.I want a camera that I can rely on to capture photos and it's not this model!",SS,P
695,695,compression,20,12,3490190,B003O86FY0,Panasonic DMC-FX75K 14.1MP Digital Camera with 5x Optical Image Stabilized Zoom with 3 inch LCD (Black),"2-hour-long video will take up 10GB, which is relatively light compared to JPEG HD recording.",SS,nothing
696,696,compression,20,12,3617554,B003VTZE1M,Kodak Easyshare C195 Digital Camera (Silver),"It's a good work horse, but it has major issues, and if it had a flexible audio/picture compression... settings, it would be much better, but few cameras have that as an option.",CS,P
697,697,compression,20,12,3634958,B003WJR69E,Panasonic Lumix DMC-LX5 10.1 MP Digital Camera with 3.8x Optical Image Stabilized Zoom and 3.0-Inch LCD - Black,"I considered the XZ-1, but the video format being Motion JPEG on that became a deal breaker.",SS,nothing
698,698,compression,20,12,3634977,B003WJR69E,Panasonic Lumix DMC-LX5 10.1 MP Digital Camera with 3.8x Optical Image Stabilized Zoom and 3.0-Inch LCD - Black,"I have been a DSLR user for few decades and wanted a second camera for those casual shooting sessions without having to carry the bag around and this camera fit the bill perfectly.My criteria for the decision to go for this one was.Highest quality lens in a compactFastest lens possibleFastest shutter speed in a compactLargest sensor possibleRAW+Jpeg optionFull manual controlBulb option (it does not have it but with new firmware 2.0 it can do 250 second exposure which is OK with me)A great back up camera for a DSLRLow noise at high ISOHaving prepared the list based on what I wanted in a camera, Panasonic LX-5 was the answer and I could not find any better option for myself at the given price point.I have no regrets going for it and I highly recommend it to anyone looking for great picture taking tool, be it an enthusiast or a student, it will please both types.",CS,P
699,699,compression,20,12,3635055,B003WJR69E,Panasonic Lumix DMC-LX5 10.1 MP Digital Camera with 3.8x Optical Image Stabilized Zoom and 3.0-Inch LCD - Black,"White book about this camera, I followed the author's instructions to set the video options to JPEG and was surprised to find that the video loaded onto my MBA into iPhoto in MOV format without a hitch!",SS,nothing
700,700,compression,20,12,3635055,B003WJR69E,Panasonic Lumix DMC-LX5 10.1 MP Digital Camera with 3.8x Optical Image Stabilized Zoom and 3.0-Inch LCD - Black,"!Here are the steps -turn the camera onset the mode dial to Intelligent Autoset the slide switch to AF for autofocuspress the Menu/Set button to enter the menu systempress the left cursor button followed by the down button to activate the Motion Picture menupress the right button to go to the list of menu optionshighlight Rec Mode and press the right buttonchoices appear of AVCHD Lite and Motion JPEGhighlight Motion JPEG and press the Menu/Set button to select itgo back to the menu screen and highlight the next option down, Rec Quality, and select HDpress the Menu/Set button to exit the menu systemto record, press the red button on top of the camera, to the right of the shutter button.files recorded in this format should automatically load to iPhoto.Edited to add: The camera does come with a fine, string-like tether to attach the lens cap to the body of the camera.",CS,P
701,701,compression,20,12,3635229,B003WJR69E,Panasonic Lumix DMC-LX5 10.1 MP Digital Camera with 3.8x Optical Image Stabilized Zoom and 3.0-Inch LCD - Black,"I also remain very impressed with the low-light capability of this camera, I rarely use the the built-in flash... and am happy for it since (as with _any_ built in flash) the resulting light is flat.That said, i rarely use it in anything other than the RAW mode for resolution, and I have read a couple places that image compression is not always the best (thus my ongoing use in RAW).",CS,P
702,702,compression,20,12,3635303,B003WJR69E,Panasonic Lumix DMC-LX5 10.1 MP Digital Camera with 3.8x Optical Image Stabilized Zoom and 3.0-Inch LCD - Black,Takes great photos in JPEG and/or RAW plus the macro is out of this world....1CM!,SS,P
703,703,compression,20,12,3635303,B003WJR69E,Panasonic Lumix DMC-LX5 10.1 MP Digital Camera with 3.8x Optical Image Stabilized Zoom and 3.0-Inch LCD - Black,It also comes with Silkypix software to convert RAW images into JPEGS...not the highest end Lightroom software but does a commendable job for free!,CS,P
704,704,compression,20,12,3635314,B003WJR69E,Panasonic Lumix DMC-LX5 10.1 MP Digital Camera with 3.8x Optical Image Stabilized Zoom and 3.0-Inch LCD - Black,"The built in JPEG processor has no idea what to do with this all noise, and turns it into yellow blotches (among other things).",CS,N
705,705,compression,20,12,3704880,B003ZHV70M,Fujifilm FinePix Real 3D W3 Digital Camera with 3.5-Inch LCD,This camera uses a new format of mjpeg for video.,SS,nothing
706,706,compression,20,12,3705039,B003ZHV70M,Fujifilm FinePix Real 3D W3 Digital Camera with 3.5-Inch LCD,The best part is that the default setting is for the camera to take both a 3D and a standard JPEG at the same time.,CS,P
707,707,compression,20,12,3705058,B003ZHV70M,Fujifilm FinePix Real 3D W3 Digital Camera with 3.5-Inch LCD,"The 3D images look great, and some are nothing short of astounding.Also, there are many tools available that let you 'extract' two JPEG images from the MPO file and convert those into two images that can be viewed on a PC wearing those red-blue 3D glasses.",SS,P
708,708,compression,20,12,3705058,B003ZHV70M,Fujifilm FinePix Real 3D W3 Digital Camera with 3.5-Inch LCD,"), self-timer, and silent-mode, just to name the things I can remember off the top of my head.Remember though, you have to view the 3D images on the camera's LCD (which looks GREAT), or on a 3D TV, or 3D PC, or FUji's own (expensive) 3D photo-frame, OR (and this is almost a no brainer option) convert the images to 2 JPEGS and view with anaglyph (blue-red) glasses.",CS,nothing
709,709,compression,20,12,3705058,B003ZHV70M,Fujifilm FinePix Real 3D W3 Digital Camera with 3.5-Inch LCD,"I should mention that you can save the images as MPO (3D) and extract JPEGS with 3rd party software, -or- you can have them stored as MPO+JPEG via a setup option.And, if you are a MAC user, note that the software that ships with this camera (as of this writing, July 2012) is completely useless, and you will want something else, like ""AnaglyphMaker"", ""Anaglyph Workshop"" both freely downloadable from the web, to convert the images for viewing on your mac with the red-blue glasses.Also, you should be aware that the nature of 3D photography limits certain aspects of the camera's ability to automatically adjust the two images when you are ""up close"".",CS,N
