,Unnamed: 0,FeatureName,FeatureID,teamID,ReviewID,asin,title,Sentence,CS_SS,p/n
0,0,compression,20,13,382561,B0001FFMCA,Pentax Optio S40 4MP Digital Camera with 3x Optical Zoom,"Whereas other brands of digital cameras may continue to take photos below 1.30 volts, only for the hapless photographer to later discover, back on their home computer, that those ""below 1.30 volt"" jpeg files are often corrupt.",CS,N
1,1,compression,20,13,516393,B0002XQJFA,Canon EOS 20D DSLR Camera with EF-S 18-55mm f/3.5-5.6 Lens (OLD MODEL),"When I first got the camera, I shot JPEG's.",CS,nothing
2,2,compression,20,13,516393,B0002XQJFA,Canon EOS 20D DSLR Camera with EF-S 18-55mm f/3.5-5.6 Lens (OLD MODEL),"Now I would not dream of shooting anything other than RAW, because of the ability to adjust your picture before converting it to a JPEG or TIFF.",CS,nothing
3,3,compression,20,13,612979,B0007RALGO,Kodak Easyshare Z730 5 MP Digital Camera with 4xOptical Zoom,"Most of the image sensors are identical between cameras, the jpeg processing differs only slightly between cameras, its the lens that matters.",CS,nothing
4,4,compression,20,13,665989,B0009IQ62Y,Konica Minolta X60 5MP Digital Camera with 3x Optical Zoom,"Not that I ever use a cord anyways, but I still appreciate the thought.- doesn't recharge via USB, must use the stand-alone charger.- When you pull the battery out, all settings are lost which is quite annoying, particularly because one of the settings is JPEG quality which, astonishingly isn't Fine by default.+ Shot to shot speed and flash recharge are both reasonably fast.Overall, for the price paid it is an excellent semi-disposable, convenient camera for quick snapshots and I don't have to worry about lugging around a huge bulky camera, I don't need to do anything to transfer my photos to the computer other than shoot them, and it is reasonably fast and clear.",CS,P
5,5,compression,20,13,676481,B0009OVRHC,Olympus Camedia D435 5MP Digital Camera,Good options in terms of picture size/compression for a camera in this price range.,SS,nothing
6,6,compression,20,13,971519,B000GHULTM,Panasonic DMC-LX2K 10.2MP Digital Camera with 4x Optical Image Stabilized Zoom (Black),I just purchased a used LX2 and am delighted with the image quality in Jpeg and even better is the RAW performance.,CS,P
7,7,compression,20,13,1012578,B000HTIHHW,"Fuji FinePix E550, 6.0 Megapixel, 4x Optical/6.3x Digital Zoom Digital Camera","Has some problems, like the mode dial that switches modes too easily in your pocket, has a 12mp mode that isn't really 12mp, and a 6mp mode that's a bit over-sharpened and overly compressed BUT nevertheless produces nice crisp, generally well-exposed images right out of the box.",CS,P
8,8,compression,20,13,1012578,B000HTIHHW,"Fuji FinePix E550, 6.0 Megapixel, 4x Optical/6.3x Digital Zoom Digital Camera",The 12mp Fine mode also produces an alternative to the more compressed and slightly over-sharpened 6mp mode but is a little noisier and softer.,CS,nothing
9,9,compression,20,13,1074276,B000J6CDL4,Leica DIGILUX 3 7.5MP Digital SLR Camera with Leica D 14-50mm f/2.8-3.5 ASPH Lens with Optical Image Stabilization,I have printed up to A2 from RAW and with a little sharpening tweak they look fine which suprised me a previously I did not print to A2 with less than 10Mpixels.The lens is great but the pictures in jpeg can be a little soft.,CS,P
10,10,compression,20,13,1152750,B000M4MLSS,Sony Cybershot DSCW200 12.1MP Digital Camera with 3x Optical Zoom and Super Steady Shot,"The lens became stuck in the open position a couple of months ago, probably due to dust or grit from my handbag but a little compressed air fixed the issue.",SS,N
11,11,compression,20,13,1243237,B000OC0TA0,Marvel Spiderman Digital Camera w/ 3 Faceplates (94044),My son was disappointed enough that he said he didn't really care about it being Spiderman if that was the type of pics it would take.There are 2 pic resolution settings and 2 compression settings so you can end up with 4 different combinations... bottom line is that you can take somewhere between 26 and 208 photos.,SS,nothing
12,12,compression,20,13,1639222,B0013DCOZC,Sigma DP1 14MP Digital Camera,I haven't had it long but I learned to shoot in RAW and use the Sigma software to convert to JPEG.,SS,nothing
13,13,compression,20,13,1639222,B0013DCOZC,Sigma DP1 14MP Digital Camera,Blown up to 100% even in JPEG you will see photos with no noise great color and gobs of detail.,SS,nothing
14,14,compression,20,13,1639263,B0013DCOZC,Sigma DP1 14MP Digital Camera,"One small note: to have best pictures, shoot RAW and use the latest Sigma Photo Pro (can be downloaded from Sigma website) to convert pictures to JPEG.",CS,P
15,15,compression,20,13,1828578,B0019FJM7W,Olympus Evolt E520 10MP Digital SLR Camera with Image Stabilization (Body Only),"- Excellent amount of customization and shooting modes- intuitive interface, super user friendly- displays a lot of useful information on a display and allows to changes settings easily from there- anti dust ultrasonic wave function to clean sensor (never cleaned mine so far)- functions found only in higher end DSLRs from other brands- excellent jpeg colors straight from the camera- double memory card slot CF  and XD- in body image stabilization IS, also can be adjusted manually for manual non-chip lens- high quality kit lens- not so great in low light resulting in grainy pictures- 2x crop factor great for reach when shooting wildlife- small sensor- autofocus in low light uses flash bursts which is quite annoying unless you get FL-50R flash that has infrared beams AFall in all is a great camera, that surprises me after so many years with ability for customization for every shooting situation, just recently I looked up Bremizer method and it discussed about assigning and locking your exposure and autofocus to another button.",CS,P
16,16,compression,20,13,2019371,B001FSKDWG,Panasonic Lumix DMC-G1 12.1MP Micro Four Thirds Interchangeable Lens Digital Camera with Lumix G Vario 14-45 mm f/3.5-5.6 ASPH Mega OIS Lens (Black),Jpeg images are also quite nice.,SS,P
17,17,compression,20,13,2031910,B001G5ZTLS,Canon EOS 5D Mark II Full Frame DSLR Camera (Body Only) (OLD MODEL),"The second limitation is that the movies are ""finished"" in the same way that JPEGs are finished, which is to say that there's no movie RAW mode.",CS,N
18,18,compression,20,13,2100275,B001K3JPRA,Olympus E30 12.3MP Digital SLR with Image Stabilization (Body Only),The picture quality is typical of Olympus cameras with very good JPEG shots right out of the camera.,SS,P
19,19,compression,20,13,2194934,B001OC7ITY,Kodak Easyshare M340 Digital Camera (Silver),"Now, four months later, the lens again zooms out instantly retracts and shuts down.I did all of the troubleshooting recommended, like compressed air cleaning and various resets, but no good.So I may send it back to United Camera ($64 for standard lens repair) and hope that it lasts this time as a backup.I have ordered her a Panasonic DMC-ZR3 replacement.",CS,P
20,20,compression,20,13,2284043,B001SER44W,Canon PowerShot SX1IS 10 MP CMOS Digital Camera with 20x Wide Angle Optical Image Stabilized Zoom and 2.8-inch LCD,I have never been impressed with either AVCHD or mp4 formats when compared to the less-compressed .mov format that this camera uses.,SS,P
21,21,compression,20,13,2284043,B001SER44W,Canon PowerShot SX1IS 10 MP CMOS Digital Camera with 20x Wide Angle Optical Image Stabilized Zoom and 2.8-inch LCD,I suspect that the reason why dedicated HD camcorders today do not use the .mov format and use the highly compressed AVCHD and mp4 is to save on memory usage and battery consumption at the expense of image and sound quality.,SS,nothing
22,22,compression,20,13,2284043,B001SER44W,Canon PowerShot SX1IS 10 MP CMOS Digital Camera with 20x Wide Angle Optical Image Stabilized Zoom and 2.8-inch LCD,This camera records audio with uncompressed linear PCM stereo which is non-existent in the current crop of consumer camcorders (as of 2/2012).,SS,nothing
23,23,compression,20,13,2284043,B001SER44W,Canon PowerShot SX1IS 10 MP CMOS Digital Camera with 20x Wide Angle Optical Image Stabilized Zoom and 2.8-inch LCD,The AVCHD codec used in most video cameras today is a clearly inferior format due to the aggressive compression standards that are not used in the SX1 IS.,CS,N
24,24,compression,20,13,2329645,B001TX9P6W,Olympus Evolt E620 12.3MP Live MOS Digital SLR Camera with Image Stabilization and 2.7 inch Swivel LCD w/ 14-42mm f/3.5-5.6 Zuiko Lens,"Every lens you mount is stabilized, even old manual focus stuff; it comes in incredibly handy.Olympus is rightfully renowned for its jpeg processing engine, which continues to impress me in the E620.",SS,P
25,25,compression,20,13,2329645,B001TX9P6W,Olympus Evolt E620 12.3MP Live MOS Digital SLR Camera with Image Stabilization and 2.7 inch Swivel LCD w/ 14-42mm f/3.5-5.6 Zuiko Lens,"A lot of people think of jpeg processing as a ""meh"" feature, claiming that all shooting should be done in RAW, but to those people I say - well, I'd rather be shooting than processing.",CS,P
26,26,compression,20,13,2388521,B001WAKSCW,Panasonic DMC-GH1K 12.1MP Four Thirds Interchangeable Lens Camera with 1080p HD Video,"The kit lens is simply not fast enough (f4-f5.6) for shooting decent quality indoors photos in most cases.5) If you plan to edit your videos, shoot MJPEG.",CS,P
27,27,compression,20,13,2388521,B001WAKSCW,Panasonic DMC-GH1K 12.1MP Four Thirds Interchangeable Lens Camera with 1080p HD Video,"The AVCHD 1080i resolution is not a benefit, when the quality sucks compared to MJPEG 720p.",SS,nothing
28,28,compression,20,13,2398132,B001XURPQI,Canon EOS Rebel T1i 15.1 MP CMOS Digital SLR Camera with 3-Inch LCD (Body Only),Files in PS are large when you are using either raw or fine jpeg -- 5184x3254 at 240 dpi is large file.,SS,P
29,29,compression,20,13,2398458,B001XURPQI,Canon EOS Rebel T1i 15.1 MP CMOS Digital SLR Camera with 3-Inch LCD (Body Only),"My other cameras were pretty basic, the old Pentax K-1000, and a Minolta Maxxum 300si, so this Canon is quite an upgrade for me.Pros:Autofocus is pretty fast and accurate.RAW + JpegRecharging batteryImage stabilizationMenu is fairly simpleAbility to setup custom settings for easy accessLots of settings, from basic ""point and shoot"" to more complex creative featuresGood compatibility with Mac'sCons:Like most SLR's, it's big and somewhat heavyShooting in low light is not always easy, if the meter cannot assess the low light situation the shutter will not activateSoftware it comes with is not very good.",CS,P
30,30,compression,20,13,2536261,B002CGSYKS,Olympus PEN E-P1 12 MP Micro Four Thirds Interchangeable Lens Digital Camera with 14-42mm f/3.5-5.6 Zuiko Digital Zoom Lens (Silver Body/Black Lens),"JPEGs straight from the camera are gallery-worthy (depending on the photographer's skill, of course).",SS,P
31,31,compression,20,13,2536270,B002CGSYKS,Olympus PEN E-P1 12 MP Micro Four Thirds Interchangeable Lens Digital Camera with 14-42mm f/3.5-5.6 Zuiko Digital Zoom Lens (Silver Body/Black Lens),The default color images that come out of the Olympus JPEG engine beat my 2 Nikon DSLRs.,CS,nothing
32,32,compression,20,13,2536274,B002CGSYKS,Olympus PEN E-P1 12 MP Micro Four Thirds Interchangeable Lens Digital Camera with 14-42mm f/3.5-5.6 Zuiko Digital Zoom Lens (Silver Body/Black Lens),I have also compared the pictures taken with E-P1 vs Canon XSI and I am impressed by the JPEG quality from E-P1.,SS,P
33,33,compression,20,13,2631735,B002IKLJU0,Panasonic Lumix DMC-FZ35 12.1MP Digital Camera with 18x POWER Optical Image Stabilized Zoom and 2.7 inch LCD,The camera can also take photos in the standard JPEG format.One really nice feature is that the end of the camera lens assembly is threaded and accepts attachments.,SS,P
34,34,compression,20,13,2631882,B002IKLJU0,Panasonic Lumix DMC-FZ35 12.1MP Digital Camera with 18x POWER Optical Image Stabilized Zoom and 2.7 inch LCD,"I could go on detailing, but so far i've found only two remarks - the camera doesn't shoot 3 RAWs for HDR as I hoped, instead it shoots 3 JPEGs; and pic quality is not that good in artificial light (except if not VERY bright).",CS,P
35,35,compression,20,13,2638986,B002IVVBZC,Kodak Easyshare C182 Digital Camera (Blue),I sent it in to be checked out and they told me it had compression damage on the display window.,SS,N
36,36,compression,20,13,2687570,B002LITT3I,Canon PowerShot SX20IS 12.1MP Digital Camera with 20x Wide Angle Optical Image Stabilized Zoom and 2.5-Inch Articulating LCD,I can now save my pictures in RAW format and the SUPERFINE JPEG format has been restored.,SS,P
37,37,compression,20,13,2687570,B002LITT3I,Canon PowerShot SX20IS 12.1MP Digital Camera with 20x Wide Angle Optical Image Stabilized Zoom and 2.5-Inch Articulating LCD,"For those who hated the soft focus of the so called (auto settings), but are afraid of trying the raw DNG format, the restored superfine jpeg settings should give you that sharpness you are looking for",SS,nothing
38,38,compression,20,13,2688031,B002LITT42,Canon PowerShot S90 10MP Digital Camera with 3.8x Wide Angle Optical Image Stabilized Zoom and 3-Inch LCD,Jpeg picture quality is great!,SS,P
39,39,compression,20,13,2694214,B002M2TLLI,Wingscapes WSCA04 Timelapse Outdoor PlantCam,You can import the photos from  an SD card right into iPhoto but you'll have to then export them as sequential JPEGs to another file folder for the compiler to process them.,SS,P
40,40,compression,20,13,2694214,B002M2TLLI,Wingscapes WSCA04 Timelapse Outdoor PlantCam,At 30 frames per second even weeks of photos shot every 5 minutes can be compressed into just a minute or so of video if you're aggressive with your editing and only include those photos with action and adequate lighting while keeping enough others to show the passage of days and time of day.,CS,P
41,41,compression,20,13,2720452,B002MUAEX4,Panasonic Lumix DMC-GF1 12.1MP Micro Four-Thirds Interchangeable Lens Digital Camera with LUMIX G 20mm f/1.7 Aspherical Lens,Definitely the best Camera I ever come across.The picture is so sharp and clear.I like the jpeg color although people have said it is less saturated.I have switched to a Canon 550D and prefer the GF1 by miles.I kick myself everyday for selling my GF1 + 20mm lens.The Canon 550D with kit lens is inferior.The Canon 550D with 50mm 1.8 II is blur most of the time when shot wide open f1.8I've to shoot it at f3.5 for pictures to be acceptable.I've to written to Canon but no help there.,CS,P
42,42,compression,20,13,2732535,B002NEGTTW,"Canon EOS 7D 18 MP CMOS Digital SLR Camera, Body Only (DISCONTINUED)",Just take a little compressed air and blow all the water off when you're done.,CS,N
43,43,compression,20,13,2732552,B002NEGTTW,"Canon EOS 7D 18 MP CMOS Digital SLR Camera, Body Only (DISCONTINUED)",Shooting in Jpeg with NR off I believe you can shoot at 8fps until the memory card is full.Things that are good:-ISO performance.,SS,P
44,44,compression,20,13,2732564,B002NEGTTW,"Canon EOS 7D 18 MP CMOS Digital SLR Camera, Body Only (DISCONTINUED)","Honestly, I shoot small or medium JPEG casually as that yields the same if not better results than my former 20D (Which is also a wonderful camera, but going back to it is so hard because I've gotten used to all the benefits and perks of this one).",CS,P
45,45,compression,20,13,2732567,B002NEGTTW,"Canon EOS 7D 18 MP CMOS Digital SLR Camera, Body Only (DISCONTINUED)","If you shoot only JPEG-format, an 8-GB CF card holds more than 1000 images.",CS,nothing
46,46,compression,20,13,2732567,B002NEGTTW,"Canon EOS 7D 18 MP CMOS Digital SLR Camera, Body Only (DISCONTINUED)",If you shoot RAW+JPEG you can store about 250 images on an 8-GB card.,SS,nothing
47,47,compression,20,13,2732581,B002NEGTTW,"Canon EOS 7D 18 MP CMOS Digital SLR Camera, Body Only (DISCONTINUED)","(I don't want to have too many images on one card in case card ever had a failure) Shooting in RAW and JPEG, and save raw images as 'hi res"" jpegs to print.",SS,N
48,48,compression,20,13,2741123,B002NX13QC,Leica X1 12.2MP APS-C CMOS Digital Camera,"(However, printing RAW files is expensive, and cannot be done at your local Costco, so you may have to use the jpeg super fine setting for snap shots.)",SS,P
49,49,compression,20,13,2741123,B002NX13QC,Leica X1 12.2MP APS-C CMOS Digital Camera,"The colors on the jpeg formatted photos are a little too saturated, and you do miss a lot of detail.",SS,N
50,50,compression,20,13,2741123,B002NX13QC,Leica X1 12.2MP APS-C CMOS Digital Camera,I use a larger a larger memory card and shoot in RAW and jpeg so I have a choice of what to use.I look at this camera as a bargain M9.,CS,P
51,51,compression,20,13,2741138,B002NX13QC,Leica X1 12.2MP APS-C CMOS Digital Camera,"Snapped some more, cranked up the ASA to 3200, played with the manual focus-pretty fun, played with the saturation and contrast settings, and I did side by side looks in iphoto at the jpeg vs dng files.",CS,P
52,52,compression,20,13,2747092,B002OEBTC8,Pentax K-x  Digital SLR with 2.7-inch LCD and 18-55mm f/3.5-5.6 AL Lens (Black),"Huge files motion JPEG format, easy editing.",SS,P
53,53,compression,20,13,3006200,B0031RGEOA,Olympus FE-47 14 MP Digital Camera with 5x Optical Zoom and 2.7-inch LCD (Red),"On occasion when I was shooting, my thumb would compress the battery cover button and accidently popped out the batteries.",SS,nothing
54,54,compression,20,13,3006412,B0031RGEQS,Olympus Stylus 7030 14 MP Digital Camera with 7x Wide Angle Dual Image Stabilized Zoom and 2.7-inch LCD (Blue),When transferred to jpegs quality remains.,SS,nothing
55,55,compression,20,13,3007325,B0031RGGBG,Kodak EasyShare M580 14 MP Digital Camera with 8x Wide Angle Optical Zoom and 3.0-Inch LCD (Pink),"It is fully charged, appears to be completely undamaged, have tried compressed air.",SS,P
56,56,compression,20,13,3007386,B0031RGGC0,Kodak Easyshare M580 14 MP Digital Camera with 8x Wide Angle Optical Zoom and 3.0-Inch LCD (Blue),"It is fully charged, appears to be completely undamaged, have tried compressed air.",SS,P
57,57,compression,20,13,3007950,B0031RGGFM,Kodak Easyshare Z981 14 MP Digital Camera with Schneider-Kreuznach Variogon 26xWide Angle Optical Image Stabilized Zoom Lens and 3.0-Inch LCD Sreen,"However, this one will allow an ISO of up to 1600 vs. the old camera's 400, so it's kind of a wash.My old 2 gig SD card will definitely not be big enough for this thing - 4 meg JPEGs or 25 meg KDC raws will fill it up fast.",SS,P
58,58,compression,20,13,3008038,B0031RGGFM,Kodak Easyshare Z981 14 MP Digital Camera with Schneider-Kreuznach Variogon 26xWide Angle Optical Image Stabilized Zoom Lens and 3.0-Inch LCD Sreen,"I could shoot about 400 non-flash images with the Z610; this one was down to an indicated critical low battery level in 256 shots.The Z981 also offers RAW files as well as JPEGs, an improvement over the Z610, but I ended up shooting mostly JPEG's anyway.",SS,P
59,59,compression,20,13,3008038,B0031RGGFM,Kodak Easyshare Z981 14 MP Digital Camera with Schneider-Kreuznach Variogon 26xWide Angle Optical Image Stabilized Zoom Lens and 3.0-Inch LCD Sreen,"RAW is better than JPEG, but not if the camera refuses to shoot.To top it off, unlike with my Z610, from which I could simply remove the memory card and stick it in my computer's card reader to transfer files, I had to load a Kodak program onto my computer to get the shots into my computer because my card reader refused to recognize the Z981's memory card.I'm just glad that I can return the camera and this debacle will be only a $40 mistake, rather than a $200 disaster.",CS,N
60,60,compression,20,13,3013778,B00328HR76,Sony Cyber-shot DSC-HX5V 10.2 MP CMOS 10x Wide-Angle Zoom Digital Camera with Optical Steady Shot Image Stabilization and 3.0 Inch LCD,"While I stitch 360 or 180 degree shots with hi-resolution and file sizes of 50-75 meg, the nice,  but small panorama the Sony provides comes in around 3-4 meg jpeg file.",SS,P
61,61,compression,20,13,3013962,B00328HR76,Sony Cyber-shot DSC-HX5V 10.2 MP CMOS 10x Wide-Angle Zoom Digital Camera with Optical Steady Shot Image Stabilization and 3.0 Inch LCD,"It is the standard for high definition recording, as its compression is more efficient than motion JPEG and you can record for longer periods.",CS,P
62,62,compression,20,13,3014263,B00328HR94,Sony DSC-W370 14.1MP Digital Camera with 7x Wide Angle Zoom with Optical Steady Shot Image Stabilization and 3.0 inch LCD (Silver),"If you're in love with the idea of a reasonably priced camera with a 7x optical zoom in a compact body, the W370 is worth checking out, but it's not without sacrifice.Key specs Sony Cyber-shot DSC-W370Dimensions (WHD) 3.9x2.2x1 inchesWeight (with battery and media) 6.3 ouncesMegapixels, image sensor size, type 14 megapixels, 1/2.3-inch CCDLCD size, resolution/viewfinder 3-inch LCD, 230K dots/NoneLens (zoom, aperture, focal length) 7x, f3.6-5.6, 34-238mm (35mm equivalent)File format (still/video) JPEG/MPEG-4 (.MP4)Highest resolution size (still/video) 4,320x3,240 pixels/1,280x720 at 29.97fps (progressive)Image stabilization type Optical and digitalBattery type, CIPA rated life Lithium ion rechargeable, 230 shotsBattery charged in camera No, external charger suppliedStorage media Memory Stick Pro Duo, SD, SDHCBundled software Picture Motion Browser 5.0 (Windows), PMB Portable 1.1 (Windows, Mac)The camera is available in silver--actually more of gun-metal gray; red; and green versions, all have chrome trim on the top and right side, and the W370's body is compact enough to squeeze in most pants pockets or handbags.",CS,P
63,63,compression,20,13,3014869,B0032ANBXI,Casio EX-FH100 10.1MP High Speed Digital Camera with 10x Ultra Wide Angle Zoom with CMOS Shift Image Stabilization and 3.0 inch LCD,"But if you can be happy with a LARGE JPEG and the flexibility to shoot in all modes...aperture, shutter, manual... you'll like this cost effective black box.That is all saying NOTHING about it's ability to shoot slow motion video which I hope to montage with the HD video I can get with my Canon 5DM2.I suspect the disappointed people in previous reviews did not know how to actually work the camera.",CS,P
64,64,compression,20,13,3026013,B0032JRRXY,Canon PowerShot A495 10.0 MP Digital Camera with 3.3x Optical Zoom and 2.5-Inch LCD (Blue),"Video does produce a reasonable quality product, but the compression algo.",SS,P
65,65,compression,20,13,3052100,B0034XFG86,Nikon Coolpix P100 10 MP Digital Camera with 26x Optical Vibration Reduction (VR) Zoom and 3-Inch LCD (Black),"The video feature is great, but I need to figure out how to get it into compressed avi and I haven't got that skill yet.If I had to buy another camera, it would have to be AT LEAST as good as this camera or I won't buy it.",SS,P
66,66,compression,20,13,3053141,B0034XIM82,Nikon Coolpix S8000 14.2MP Digital Camera with 10x Optical Vibration Reduction (VR) Zoom and 3.0-Inch LCD (Black),I can print some awesome enlargements (20 x 20 and above) from the jpeg files and it is super in low light levels.,SS,P
67,67,compression,20,13,3053141,B0034XIM82,Nikon Coolpix S8000 14.2MP Digital Camera with 10x Optical Vibration Reduction (VR) Zoom and 3.0-Inch LCD (Black),Yes my Nikon D700 can take marvelous RAW and JPEG photos at extremely low light levels at up to 8 fps.,SS,P
68,68,compression,20,13,3066993,B0035FZJHQ,Canon EOS Rebel T2i DSLR Camera with EF-S 18-55mm f/3.5-5.6 IS Lens (OLD MODEL),"Noise level is good, although in very low-light situations, RAW photos can start to look sketchy, so I'd suggest sticking to JPEG for this purpose unless you have a quality RAW convert with good noise reduction.",SS,nothing
69,69,compression,20,13,3067124,B0035FZJHQ,Canon EOS Rebel T2i DSLR Camera with EF-S 18-55mm f/3.5-5.6 IS Lens (OLD MODEL),"I was very impressed with this camera and would recommend it for family photo takers with some photography experience, high school or college students interested in photography, or just as a step up from the cheapest/simplest point and shoot cameras.Pros:-Easy to use controls and functions-Great auto settings for those who like it simple, and great manual settings for people looking to experiment-Great built in flash-LCD is large and bright-Very small form factor for what it offers-Feels and looks a lot more professional, but not a D7 feel-I love that the camera senses when your eye is at the viewfinder and automatically shuts of the LCD-Can take pictures using the LCD-Pretty good continuous fast photos for most-Option to save in RAW or JPEG (OR BOTH AT THE SAME TIME!",CS,P
70,70,compression,20,13,3067403,B0035FZJHQ,Canon EOS Rebel T2i DSLR Camera with EF-S 18-55mm f/3.5-5.6 IS Lens (OLD MODEL),Background:Film cameras like Ricoh SLX + 50mm 1.4Olympus Mju ICanon G10Canon S90Canon S95Panasonic GF1 + 20mm / 14-45 OIS lens.I sold all but kept the S95 and bought a Canon 550D.Canon 550D experience:I have switched to a Canon 550D but prefer the GF1 by miles.I kick myself everyday for selling my GF1 + 20mm lens.The Canon 550D kit lens is much inferior to Panasonic 14-45mm.The Canon 550D with 50mm 1.8 II is blur most of the time when shot wide open f1.8I've to shoot it at f3.5 for pictures to be acceptable - still not sharp enough.Contrast detect solves the problem - but is too slow.I've to written to Canon but no help there.If someone knows a solution pls help.Maybe you'll hear it the first time here (though I've posted this somewhere else) - Canon 550D Jpeg is not friendly for asian skintone - it turns asian skin darker and reddish.,CS,nothing
71,71,compression,20,13,3067403,B0035FZJHQ,Canon EOS Rebel T2i DSLR Camera with EF-S 18-55mm f/3.5-5.6 IS Lens (OLD MODEL),The Jpeg seems to be designed for Caucasian skintone.Nikon D90 is the same - turns asian skin darker and reddish.Panasonic & Pentax jpeg turns skin fairer but landscape is not saturated enough.,SS,nothing
